标题,来源,发布时间,简介,链接
天气炎热 该如何预防中暑,99健康网,2019年06月02日,"天气一热人就觉得不舒服,很多人一到夏天就很容易中暑,那么中暑有哪些症状呢?中暑吃什么比较好呢? 中暑的症状 中暑是因为闷热或者高温而引起的一种急性疾病。先兆...",https://news.99.com.cn/minsheng/20190602/755814.htm
"阴雨天气即将重返贵州,周二夜间暴雨又要来",澎湃新闻,2019年06月02日,"贵阳市天气预报:今天夜间到明天白天,多云间晴。明天夜间到4日白天,多云转阴天有阵雨或雷雨。4日夜间到5日白天,阴天有阵雨或雷雨,雨量中到大雨。 文:贵州日报当代...",http://www.thepaper.cn/newsDetail_forward_3591881
"攻略丨天气炎热,教您轻松制作几款清热解毒的饮品",澎湃新闻,2019年06月02日,"暑天已至 暑意渐渐显示出来 接下来的几个月 没有最热 只有更热 天气炎热难耐 易伤脾胃 食欲变差 觉得夏天的燥热很难熬,其实除了吹空调、吃冷饮这些降温方法,还有",http://www.thepaper.cn/newsDetail_forward_3591831
6月5日青岛多云天气 局部地区有阵雨或雷阵雨,半岛网,2019年06月03日,"信网6月3日讯 3日白天青岛晴间多云,莱西平度等地局部短时阴,有阵雨或雷阵雨,南风内陆4-5级 阵风7级,海上及沿海5-6级 阵风7级,截止到今天15:40,市区最低...",http://news.bandao.cn/a/246243.html
高考期间滁州多云天气 气温凉爽适合应考,安徽网,2019年06月03日,"安徽网 大皖客户端讯 安徽省气象台预计,3日至5日白天全省以晴到多云天气为主,6日前后全省有一次降雨过程,部分地区有大暴雨。 记者从滁州气象部门获悉,虽然前几...",http://www.ahwang.cn/chuzhou/news/20190603/1881051.shtml
本周 贵州以多云天气为主 有两次强降雨,多彩贵州网,2019年06月03日,"据省气象台预报,本周我省有两次强降雨天气过程,分别出现在周二至周三和周五至周六,雨量中到大雨,局部暴雨,个别地区有大暴雨;其余时段除周四夜间有阵雨或雷雨外,我...",http://news.gog.cn/system/2019/06/03/017260288.shtml
今日新疆大部以多云天气为主 乌鲁木齐最高气温27℃,新疆青年网,2019年06月03日,新疆青年网主要为网友们提供今日新疆大部以多云天气为主 乌鲁木齐最高气温27℃相关信息;详细内容(天山网讯(记者余梦凡 张万德报道)6月的第一个工作周来啦!今天全...,http://www.xjqnpx.com.cn/news/society/131651.html
"服务“兰马”,兰州气象设备将滚动播放赛道天气预报和实况",每日甘肃网,2019年06月02日,"赛的现场气象设备已经完成最后调试,进入重大活动保障和服务状态,运动员和广大市民将在赛道起终点LED显示屏上看到赛道7个重要地点逐小时的天气预报和逐5分钟的天气实况...",http://gansu.gansudaily.com.cn/system/2019/06/02/017198117.shtml
江南南部华南有较强降雨 华北黄淮等地将有雷雨天气,中国气象局,2019年06月01日,"6月1日至3日,受高空槽东移影响,华北东部、黄淮中东部、东北地区中南部等地多雷雨天气,局地有雷暴大风或冰雹天气。 受暖脊影响,预计,6月2日至5日,华北东部、...",http://www.cma.gov.cn/2011xwzx/2011xqxxw/2011xzytq/201906/t20190601_526172.html
未来3天山东将迎雷暴大风冰雹天气 气温或超37℃,华夏经纬,2019年06月03日,"1日18时,中央气象台发布强对流天气预报:6月1日20时至2日20时,内蒙古中部、辽宁北部、山东北部等地的局地将有雷暴大风或冰雹天气。 另据山东省气象台消息,今天...",http://www.huaxia.com/sd-tw/jrsd/qlsk/2019/06/6125455.html
白纸坊在行动 街道全面开展大风天气安全隐患排查工作,首都之窗,2019年06月03日,"北京市政府信息公开专栏,西城区人民政府白纸坊街道办事处,工作动态,白纸坊在行动 街道全面开展大风天气安全隐患排查工作",http://www.beijing.gov.cn/zfxxgk/xcq11B068/gzdt53/2019-06/03/content_6982cb5c03df4680b79cc2c45267e106.shtml
门头沟局:“四查一强”积极应对大风天气,首都之窗,2019年06月03日,"北京市政府信息公开专栏,北京市门头沟区城市管理综合行政执法监察局,工作动态,门头沟局:“四查一强”积极应对大风天气",http://www.beijing.gov.cn/zfxxgk/mtg11J037/gzdt53/2019-06/03/content_a2b903f26ad34b10b4baa815ca13dddb.shtml
东营发布双重预警 将迎来大风、降水及冰雹天气,东营大众网,2019年06月04日,"4日下午15时,东营市气象局同时发布蓝色大风预警及雷电黄色预警。 预警提醒,预计今天下午到傍晚,东营市部分地区有雷电活动并伴有短时强降水和7～8级雷雨大风,局地...",http://dongying.dzwww.com/dyxw/201906/t20190604_16939328.htm
都是成年人了 这糟心的天气你能挺住的!,中国天气网,2019年06月01日,不管是这残酷的天气 还是其他糟心的事 都依然能保有孩子般的乐观 儿童节快乐~查天气 关注“中国天气网”微信公众号编辑:朱茜 转载请注明“来源:中国天气网” 继续...,http://www.weather.com.cn/lte/2019/06/3197828.shtml
多部门联动应对近期强降水天气过程,中国天气网,2019年06月01日,"受西南暖湿气流和北方冷空气共同影响,6月2日白天至7日,巩留区域将进入多雨时段,将有两次大的降水天气过程,预计两次降水天气过程的累计降雨量普遍在15毫米以上,...",http://www.weather.com.cn/xinjiang/xjsy/tqyw/3197765.shtml
广东优良天气比例前4月同比提升5.6%,南方网,1小时前,"4日,省生态环境厅发布消息,今年1―4月,全省空气持续改善,与2018年同期相比,全省优良天气比例(AQI达标率)上升5.6%,预计今年有望实现空气质量连续5年达标。",http://news.southcn.com/gd/content/2019-06/05/content_187855507.htm
海洋天气公报,中国气象局,2小时前,"三、天气影响和关注重点 预计,6日白天至7日夜间,受入海气旋影响,黄海中部和南部海域将有7～9级、阵风10级大风,黄海北部海域、东海北部海域将有6～8级、阵风9级...",http://www.cma.gov.cn/2011xwzx/2011xqxxw/2011xzytq/2011xqxgg/201906/t20190605_526410.html
“六一”山城天气晴好利出游 明后两天最高温可达36℃,华龙网,2019年06月01日,"今(1)日,重庆大部地区都将以阴天转多云为主,全市最高温32℃,主城最高30℃,较适宜外出活动。明后两天,各地天气将彻底放晴,全市最高温将上升至36℃。",http://cq.cqnews.net/html/2019-06/01/content_50486728.html
强对流天气蓝色预警 河南广东等9省市区有短时强降水,新浪新闻,2小时前,"中国天气网讯中央气象台6月5日06时继续发布强对流天气蓝色预警:预计6月5日08时至6日08时,吉林中东部、河南、湖北、湖南西北部、四川东北部、贵州南部等地的局...",http://news.sina.com.cn/o/2019-06-05/doc-ihvhiqay3637769.shtml
"吉林敦化突现震撼天气现象:宛如黑洞,疑为“超级单体”",观察者网,2019年06月03日,"吉林敦化突现震撼天气现象 宛如黑洞,疑为“超级单体”本文原标题 《敦化突现震撼天气现象,宛如黑洞。这就是传说中的‘单体风暴’吗……”还有不少当地网友都拍到...",https://www.guancha.cn/politics/2019_06_03_504141_s.shtml
高考恰逢端午 武威天气晴好,中国天气网,2019年06月04日,"高考、端午期间武威市总体天气晴好,利于考生正常发挥和节日期间走亲访友。最高气温凉州、民勤在29～32℃,气温偏高,注意防暑降温;古浪、天祝在22～26℃,气温适宜,6...",http://www.weather.com.cn/gansu/gdxw/06/3198917.shtml
昆明天气多变小孩易患呼吸道疾病 专家提醒家长注意,广西新闻网,2019年06月01日,"汤春辉介绍,昆明夏季天气多变,昼夜温差较大,孩子容易患上呼吸道感染,并可能导致小孩患有消化系统疾病,或者出现有皮肤过敏的现象,家长应及时关注。“此外,哪怕天气热...",http://www.gxnews.com.cn/staticpages/20190601/newgx5cf24ad7-18373343.shtml
昆明天气多变小孩易患呼吸道疾病 专家提醒家长注意防患,大众网,2019年06月01日,"云南网讯(记者 彭锡)“最近昆明天气多变,小孩容易患上呼吸道感染,家长得多当心。”6月1日,云南省第一人民医院(下称:省一院)儿科主任医师汤春辉表示,家长应注意...",http://www.dzwww.com/xinwen/shehuixinwen/201906/t20190601_18784967.htm
珠峰中国一侧天气罕见恶劣 冲顶阶段无伤病非传统路线尝试未果,腾讯网,2019年05月31日,"“这是19年来最差的天气了。”来自瑞士的登山公司经营者卡里・科布勒在海拔5200米的珠峰北坡登山大本营对记者说。科布勒今年64岁,过去20多年间曾16次来到中国一侧...",https://sports.qq.com/a/20190531/007738.htm
天气干热 气温持续攀升,新浪新闻,2019年05月31日,"本报讯(记者高桦)5月收尾,我省晴云作伴,天气干热,气温持续攀升,本周末或将再战高温。山西省气象台5月30日最新预报,预计31日白天我省北中部晴天转多云,南部多云...",http://news.sina.com.cn/o/2019-05-31/doc-ihvhiqay2673486.shtml
天公作美 高考天气不“高”“烤”,大众网,2小时前,"本报讯(记者马冬胜)6月7日将迎来高考日,这几天天气会不会“高”“烤”呢?据省气象台预报,未来三天我省天气凉爽,中南部最高气温不会超过33℃。不过,雷阵雨...",http://www.dzwww.com/xinwen/shehuixinwen/201906/t20190605_18796840.htm
雷锋内玄机图_北京雾霾天气将于今日基本结束重回晴天,中国质量新闻网,2019年06月01日,北京雾霾天气将于今日基本结束重回晴天跌幅与同期上证指数跌幅19.27%较为接近。且估值比较安全(目前中国平安和中国太保09年新业务倍数2025倍。 引进内资2.54亿元。中方...,http://www.cqn.com.cn/common/auto/foucs/content_76711113964.htm
新疆:天气影响独库公路延后通车气象服务及时跟进,中国气象局,2019年05月31日,"中国气象报通讯员李志宏 朱容慧报道 5月30日,接到新疆维吾尔自治区气象台发布的重要天气信息后,自治区交通厅、公路局和旅游文化厅等部门根据预报延后独库公路通车...",http://www.cma.gov.cn/2011xwzx/2011xgzdt/201905/t20190531_526150.html?ivk_sa_s=130828&from=singlemessage&isappinstalled=0
郑州冰雹天气来袭!郑州发布雷电黄色预警将有雷暴大风、冰雹天气,万家热线,2019年06月03日,"市气象台2019年06月03日15时55分发布雷电黄色预警信号:预计未来6小时内,郑州市区及所辖六县(市)将有雷电活动,局地伴有雷暴大风、冰雹、短时强降水等强对流天气...",http://365jia.cn/news/2019-06-03/97AE198731A988D2.html
做好雷暴大风天气的安全防范工作,大众网,2019年06月03日,"做好雷暴大风天气的安全防范工作吉林省气象台6月3日10时5分发布雷电黄色预警信号:预计未来12小时,松原南部、长春、四平、辽源、吉林、通化、白山、延边西部、长白山...",http://www.dzwww.com/xinwen/guoneixinwen/201906/t20190603_18790870.htm
新海诚自编自导新作!《天气之子》发布中字预告,电影网,2019年06月04日,"由新海诚自编自导动画电影《天气之子》发布台版中字预告!这是新海诚继2016年的《你的名字》后时隔三年推出的新作,也是他的第六部长片作品。影片将于7月19日日本...",http://www.1905.com/news/20190604/1381227.shtml
高考前夜雨纷纷 端午假期天气有点”任性“?,苏州网络电视台,2019年06月04日,高考前夜雨纷纷 端午假期天气有点”任性“?(版权所有:苏州广播电视总台 未经允许不得转载)同期视频(爱国情 奋斗者)史国华:十六年潜心科研 致力开创清新“视界” ...,http://www.csztv.com/doc/2019/06/04/448964.shtml
本周滨州市 多雷雨或阵雨天气_滨州新闻_滨州大众网,大众网,2019年06月04日,"我市预计未来几天(6月4日～9日)我市多雷雨或阵雨天气,4日白天局部有雷雨或阵雨,6日、8日有雷雨或阵雨,雷雨地区雷雨时阵风7级;另外,3～4日温度较高,我市...",http://binzhou.dzwww.com/bzhxw/201906/t20190604_16938093.htm
紧急预警 南召等地有大风冰雹天气,网易河南站,2019年06月03日,(原标题:紧急预警:南召、内乡、西峡、方城部分地区有大风冰雹等极端天气)  南阳市气象台2019年6月3日17时55分发布雷电黄色预警信号:预计未来6小时内南召县、内乡...,http://henan.163.com/nanyang/19/0603/18/EGP3CIG504398DOR.html
秘诀!怎么预防冰雹天气对汽车的损害?,北青网,2019年06月03日,"2、看看天气预报,如果说今天有可能有冰雹,最好提前准备准备,套上车衣或者专用的防冰雹车衣,要是没准备,那就干脆把自己家的被子褥子拿出来糊到车上,虽然看着磕碜...",http://auto.ynet.com/2019/06/03/1862188t990.html
做好“天气题” 高考会更顺,中国广播网,2019年05月31日,"高考期间广东省正处在主汛期,今年高考期间将与气象部门更加紧密联动,通过短信、微博、微信、APP、网站、电视字幕等多种方式向社会通报天气情况。",http://www.cnr.cn/gd/gdkx/20190531/t20190531_524633815.shtml
天气预报,新京报网,2019年05月31日,今天天气15℃至30℃晴转多云北转南风2、3级明天天气多云间晴北转南风2、3级19℃至32℃... 今天天气 15℃至30℃ 晴转多云 北转南风2、3级 明天天气 多云间...,http://www.bjnews.com.cn/feature/2019/05/31/585690.html
[内蒙古新闻联播]天气预报 20190603,央视网,2019年06月03日,[内蒙古新闻联播]天气预报 20190603 发布时间:2019年06月03日 20:26 | 来源:央视网 | 手机看新闻 | 手机看视频 编辑:刘一 责任编辑: ...,http://news.cctv.com/2019/06/03/VIDEYYMacUIRVtc71SpdJaUs190603.shtml
南通市通州区公路管理站:积极应对大风天气确保辖区公路通行安全,中国银河证券,2019年06月03日,"5月27日,通州区在经历了两天的大风暴雨后周一虽说雨止住了,但是风力普遍达到5级以上,局地瞬时大风达到6-8级。当天中午S335线与G228交界处跨线桥上一块长32米宽...",http://www.chinastock.com.cn/yhwz_about.do?methodCall=getDetailInfo&docId=6814258
上海天气预报,上观,2019年06月04日,"上海天气预报2019年06月04日 02: 要闻 稿件来源:解放日报 今日 晴到多云 温度:最高32℃,最低20℃风向:东南 风力:3-4级 明日 多云,夜里转阴 温度:最高32℃...",https://www.jfdaily.com/journal/2019-06-04/getArticle.htm?id=272516
厦门气温重回30℃以上 高考期间天气闷热,东南网厦门频道,1小时前,"厦门气温重回30℃以上 高考期间天气闷热 东南网6月5日讯(海峡导报记者 李学清) 昨天受到暖气团的影响,太阳一直在线,气温重新回到30℃以上。 未来几天厦门天气以...",http://xm.fjsen.com/2019-06/05/content_22363901.htm
湘西将迎36℃高温!端午节+高考天气预报来了,澎湃新闻,2019年06月03日,"湘西融媒 根据气象台发布的最新气象资料综合分析,预计6月5日和8～9日分别有一次中等强度降水过程,局地暴雨,并伴有短时强降水、雷雨大风、局地冰雹等强对流天气。周",http://www.thepaper.cn/newsDetail_forward_3599072
请珍惜最近温和舒爽的天气 下周浙江全省将先升温再降雨,大众网,2019年05月31日,"请珍惜最近温和舒爽的天气。曾杨希)5月即将收尾,近日天气却如春季般温和舒爽,白天最高气温不足30℃,早晚甚至有些微凉,请珍惜最近温和舒爽的天气 下周浙江全省将先...",http://www.dzwww.com/xinwen/shehuixinwen/201905/t20190531_18782303.htm
中国天气网与穷游网达成战略合作新产品助力智慧旅游,和讯,2019年05月31日,"中国天气网讯 为构建全球旅游景点生活及服务体系,打造智能化旅游景点天气服务,中国天气网基于自身景点天气大数据优势,集中融合OTA线上旅游景点信息资源,于5月17日,在...",http://news.hexun.com/2019-05-31/197380018.html
河北晴热天气利于小麦生长 周末石家庄冲击40℃,和讯,2019年05月31日,"中国天气网讯 昨天(30日),河北大部地区以晴到多云的天气为主,最高气温在25℃-30℃左右,较之前的高温天气,天气感觉比较温和的。但是,河北省气象台预计,本周末...",http://news.hexun.com/2019-05-31/197374987.html
做好“天气题” 高考会更顺,大众网,2019年05月31日,"30日从省教育考试院获悉,高考期间我省正处在主汛期,今年高考期间将与气象部门更加紧密联动,通过短信、微博、微信、APP、网站、电视字幕等多种方式向社会通报天气...",http://www.dzwww.com/xinwen/shehuixinwen/201905/t20190531_18779197.htm
宁夏天气转入“高温模式”,新华网宁夏站,18分钟前,"今年高考及端午节期间,宁夏天气如何? 气象部门预计,6月4日夜间到5日白天,固原市、吴忠市东南部、中卫市南部阴有小雨。川区最高气温29℃至32℃,山区21℃至27℃...",http://www.nx.xinhuanet.com/newscenter/2019-06/05/c_1124584884.htm?from=timeline
31日天气:晴 温度14 ~ 25℃ 西北风3-4级,胶东在线,2019年05月31日,"晴,温度14 ~ 25℃,西北风3-4级,日出时间04:35,日落时间19:07。实时:气温15℃,西南风3级,湿度68%,气压1000 hPa。 烟台空气质量: 优,AQI 34,pm2.5(细颗...",http://www.jiaodong.net/news/system/2019/05/31/013880865.shtml
6/1凯道恐雷雨搅局 吴德荣:未来4天将现剧烈天气,中时电子报,2019年05月31日,"6月1日凯道将有大型造势活动,全台将有许多民涌入现场,天气状况如何备受关注。气象专家指出,未来一周天气走势,明日北部地区 恐有雷雨干扰,由于明日另一波锋面接近...",https://www.chinatimes.com/cn/realtimenews/20190531004011-260405?chdtv
今天我州出现明显降雨天气过程,中国红河,2019年05月31日,今天我州出现明显降雨天气过程作者: 来源: 红河广播电视台 时间:2019-05-31 21:01:56 今天我州出现明显降雨天气过程 (责任编辑:刘雯霁 审核:李玉清) ...,http://www.hh.cn/xw/shxw/201905/t20190531_741244.html
商丘本周天气复杂多变,凤凰河南站,2019年06月04日,"原标题:本周天气复杂多变如果用一个词来形容本周商丘市的天气将呈现出的性格,那么“刚猛”或许比较恰当。周初,商丘市气温会热得比较“刚猛”,或将出现37℃以",http://hn.ifeng.com/a/20190604/7484968_0.shtml
炒作“天气市” 油脂油料期货站上风口,中证网,2019年05月30日,"就短期而言,若美豆产区天气条件未能出现好转,油脂油料期货价格仍具上涨空间。 多头大爆发 当日油脂油料期货表现夺目,其中豆粕、豆二期货牢牢封住涨停,涨幅分别为3.98%...",http://www.cs.com.cn/zzqh/spqh/201905/t20190530_5953831.html
阳江滑坡致6人死亡 未来广东多雷雨高考期间天气闷热,新浪新闻,2019年06月04日,"中国天气网讯据央广网消息,6月2日广东阳江阳春市春湾镇大岗坪村委会沙螺坑村发生山体滑坡事件,该山体滑坡事件造成一栋3层民房一楼被掩埋,6人死亡。事件原因...",http://news.sina.com.cn/o/2019-06-04/doc-ihvhiqay3553027.shtml
印度迎高温天气 多地发布预警,新华网,2019年05月30日,印度迎高温天气 多地发布预警 2019-05-30 09:47:18 来源: 央视新闻 关注新华网  微信 微博 Qzone  评论图集 印度迎高温天气 多地发布预警...,http://www.xinhuanet.com/world/2019-05/30/c_1210147207.htm?ivk_sa=1023197a&ivk_sa_s=130824
印度迎高温天气 多地发布预警,新华网,2019年05月30日,"印度迎高温天气 多地发布预警  2019-05-30 来源: 央视新闻 印度迎高温天气 多地发布预警微信扫描二维码,关注新华网 热点推荐 我国浮空艇高空观测科考任务完成 ...",http://www.xinhuanet.com/world/2019-05/30/c_1210147207.htm?ivk_sa_s=130824
强对流天气蓝色预警 湖北河南等7省有雷暴大风或冰雹,新浪新闻,2019年06月04日,"中国天气网讯中央气象台6月4日18时继续发布强对流天气蓝色预警:预计6月4日20时至5日20时,吉林中北部、辽宁南部、山东西北部、河南中西部、湖北中西部、四川东北...",http://news.sina.com.cn/o/2019-06-04/doc-ihvhiqay3571309.shtml
中国发布|端午假期及高考期间部分地区有高温及强对流天气 不利出行,新浪新闻,2019年06月04日,"中国网6月4日讯端午假期及高考期间,江南、华南、四川盆地及贵州等地多降雨天气,局地伴有强对流天气,对交通出行不利,而华北平原、新疆东部、甘肃西部、内蒙古西部等...",http://news.sina.com.cn/o/2019-06-04/doc-ihvhiqay3567253.shtml
广西壮族自治区广西贵港全固态双偏振X波段天气雷达系统建设公开...,财政部,2019年06月04日,"中国气象局政府采购中心受广西壮族自治区委托,根据《中华人民共和国政府采购法》等有关规定,现对广西贵港全固态双偏振X波段天气雷达系统建设进行公开招标,欢迎合格的...",http://www.mof.gov.cn/xinxi/zhongyangbiaoxun/zhaobiaogonggao/201906/t20190604_3271514.html
强对流天气蓝色预警,中国气象局,2019年06月04日,"预计6月4日14时至5日14时,内蒙古东部、吉林东北部、辽宁南部、河北北部、山东北部、河南北部、甘肃南部、四川东北部等地的局地将有雷暴大风或冰雹天气;吉林东北部...",http://www.cma.gov.cn/2011zwxx/2011zyjgl/2011zyjxy/2011zqxyj/201906/t20190604_526353.html
中央气象台:东北华北多地今天有强对流天气,新华网,2019年06月04日,中央气象台:东北华北多地今天有强对流天气 2019-06-04 09:01:58 来源: CCTV 关注新华网  微信 微博 Qzone  评论 图集  【纠错】 责任编辑: 杨慧 ...,http://news.xinhuanet.com/video/2019-06/04/c_1210150915.htm
强对流天气蓝色预警,中国气象局,2019年06月04日,"预计6月4日08时至5日08时,内蒙古东部和南部、吉林东部、辽宁南部、河北北部、甘肃南部、山东西部和东部、四川盆地中东部等地的局地将有雷暴大风或冰雹天气;吉林东...",http://www.cma.gov.cn/2011zwxx/2011zyjgl/2011zyjxy/2011zqxyj/201906/t20190604_526307.html
福建迎来高温天气 消防员引导“萌娃”演练火场逃生,人民网,2019年05月31日,图为消防员黄剑斌向学生进行火场逃生授课。 李思源 摄 图为小学生学习正确使用湿毛巾捂住口鼻。 李思源 摄 图为小学生进行逃生演练。 李思源 摄 图为消防员黄...,http://yn.people.com.cn/GB/n2/2019/0531/c378440-33000070.html
中国气象局权威发布端午假期及高考天气,新浪新闻,2019年06月04日,"中国天气网讯今天(4日)下午,中国气象局召开新闻发布会,对未来十天全国天气趋势以及端午假期天气、高考天气进行了权威发布。总体来看,未来十天(5-14日)江南华南有强...",http://news.sina.com.cn/o/2019-06-04/doc-ihvhiews6752007.shtml
高考天气划重点!全国无大范围高温 8日后南方雨势强,新浪新闻,2019年06月04日,"中国天气网讯高考在即,预计今年高考期间(7-9日)南方地区大部会和雨水相伴,尤其在8-9日,江南大部、华南北部一带强降雨会迅速发展,贵州、湖南、广西等地会出现大...",http://news.sina.com.cn/o/2019-06-04/doc-ihvhiqay3497878.shtml
"完整版|古筝名曲《山居秋暝》-空山新雨后,天气晚来秋~",凤凰娱乐,2019年06月04日,"完整版|古筝名曲《山居秋暝》-空山新雨后,天气晚来秋~音乐&gt;乐器2019-06-04 10:05:4903:531527新浪微博 QQ QQ空间 微信展开 播放地址 将视频分享给站外好友...",http://ent.ifeng.com/c/7nE716twGpX
[安徽新闻联播]抢抓晴好天气 全力推进午收进度,央视网,2019年06月04日,[安徽新闻联播]抢抓晴好天气 全力推进午收进度 发布时间:2019年06月04日 19:38 | 来源:央视网 | 手机看新闻 | 手机看视频 ...,http://news.cctv.com/2019/06/04/VIDEa6GnIXbsMGKSqRIied9J190604.shtml
"天公作美,高考天气就是爽!交通限制、送考车停哪…...",澎湃新闻,2019年06月04日,"本文原标题:《天公作美,高考天气就是爽!交通限制、送考车停哪…干货满满!》 原创:晨报全媒体记者 高考倒计时 仅剩 2 天 “十年寒窗磨一剑,只待今朝问鼎时”",http://www.thepaper.cn/newsDetail_forward_3603718
"端午高考天气出炉:南方大部多阴雨,华北黄淮干热晴晒",澎湃新闻,2019年06月04日,"今年端午小长假(6月7日-9日)即将开启,这份豪华精细版假期天气快收下。 总体来看,今年端午假期期间全国无大范围高温天气,但河北南部、河南北部、海南北部等局地有...",http://www.thepaper.cn/newsDetail_forward_3601651
锋面滞留至下周一 全台天气不稳定,中时电子报,2019年06月01日,"气象局预报,锋面滞留于台湾北部海面,至下周一天气都不稳定。(资料照/季志翔摄) 字级设定:小中大特  气象局表示,今(1)日锋面位于台湾北部海面,提供大气暖湿而...",https://www.chinatimes.com/cn/realtimenews/20190601001325-260405
[共度晨光]晨光天气20190604,央视网,2019年06月04日,[共度晨光]晨光天气20190604 发布时间:2019年06月04日 09:10 | 来源:央视网 | 手机看新闻 | 手机看视频 编辑:刘一 责任编辑: ...,http://news.cctv.com/2019/06/04/VIDEp30Tbk8FPfkVKLrjXWYP190604.shtml
