标题,来源,发布时间,简介,链接
"雷阵雨+大风!雷雨连续发货,强对流天气要小心!",河北新闻网,2019年06月02日,"6月2日白天,保定、廊坊以北地区多云间阴有雷阵雨,雷雨时局地伴有短时大风、冰雹、短时强降水等强对流天气,其他地区多云。 2日夜间到3日,张家口、承德、唐山北...",http://hebei.hebnews.cn/2019-06/02/content_7411574.htm?spm=0.0.0.0.wPMYUD
杭州下周气温飙至36℃!高考、端午节天气有变化!梅雨要来了吗?,浙江在线,2019年06月02日,"下周杭州的天气整体上来看是晴多雨少,降雨主要出现在6月5日夜里到6月6日。... 下周杭州的天气整体上来看是晴多雨少,降雨主要出现在6月5日夜里到6月6日。 6...",http://cs.zjol.com.cn/zjbd/hz16503/201906/t20190602_10253633.shtml
最新天气:05月26日12时天气预报,中国天气网,2019年05月26日,"今天下午到夜里,黄河以北和开封、商丘、信阳三地区多云间阴天,部分地区有分散性阵雨、雷阵雨,局地伴有雷暴大风、短时强降水等强对流天气;其它地区多云。今天下午,...",http://www.weather.com.cn/henan/tqyw/05/3195121.shtml
27-29日广东将有大范围强降水天气 已进入“龙舟水”时节 需做好...,中国天气网,2019年05月25日,"中国天气网讯24日到25日早晨,粤西、珠江三角洲和粤北部分市县出现了中到大雨局部暴雨,其中茂名、阳江、江门部分地区出现了暴雨到大暴雨局部特大暴雨,其余市县阴天间...",http://www.weather.com.cn/guangdong/syxw/05/3194855.shtml
天气,新京报网,2019年05月21日,"今天天气:13℃至31℃,晴间多云,偏北风3、4(阵风6级)级转2级... 今天天气:13℃至31℃,晴间多云,偏北风3、4(阵风6级)级转2级92 一天 一周 一月 ...",http://www.bjnews.com.cn/feature/2019/05/21/581300.html
节日快乐!好天气陪四川的大朋友小朋友过六一,四川在线,2019年06月01日,"过节遇上这么好的天气,估计大小朋友们都已经按捺不住激动的心情了,那就赶紧、收拾收拾出门咯―― 哎～最好带把伞哟!中午至少30℃的温度,就算你们高兴得忘了“热...",https://sichuan.scol.com.cn/ggxw/201906/56991306.html
"34℃!强势升温!儿童节江西很清凉,端午节天气竟是...",澎湃新闻,2019年06月01日,今天是六一国际儿童节 在这里先祝贺 各位大朋友小朋友 节日快乐! 在这欢乐的日子里 江西天气这孩子也熊了一把 前两天的我还是这样的 这两天就变成了这样 太阳公公,http://www.thepaper.cn/newsDetail_forward_3590253
重庆天气:各地多云天气为主 明日降雨重新来袭,东方网,2019年05月22日,"5月以来,重庆频繁遭遇降雨天气,主城累积日照时数仅29.7小时,创下了自1998年以来最低值。受其影响,今年的栀子花盛花期来得较往年偏晚。重庆市气象台预计,今(22...",http://tianqi.eastday.com/news/57171.html
32℃!34℃!35℃!青岛进入高烤模式!端午天气…,青岛新闻网,2019年06月01日,"看好天气才是正经事 小编替大家看了一下 还好,假期3天 只有第一天有雨, 小问题啦,可以撒丫子玩啦!! 每次预报天气 小编都特忐忑 说了不下怕挨骂 但不说一...",http://news.qingdaonews.com/qingdao/2019-06/01/content_20382449.htm
云南出现大面积干旱天气 橡胶、白糖能否借机攀高?,东方财富期货,2019年05月30日,"【云南出现大面积干旱天气 橡胶、白糖能否借机攀高?】昨日,上海天胶价格出现了较大涨幅,同时郑州白糖期价也伺机而动,一波由云南出现大面积干旱天气而引发的天胶与...","http://futures.eastmoney.com/news/2187,201905301137758172.html"
端午+高考天气预报来了!还有这些事赶紧了解,澎湃新闻,2019年06月04日,"这周高考和端午假期将一起来临,天气怎么样?大家都很关注?下面就马上告诉你! 高考期间 天气闷热、局部有雷雨 根据南海区气象局今天发布的预报,高考(端午)期间我区",http://www.thepaper.cn/newsDetail_forward_3602417
[共度晨光]晨光天气20190531,央视网,2019年05月31日,[共度晨光]晨光天气20190531 发布时间:2019年05月31日 09:52 | 来源:央视网 | 手机看新闻 | 手机看视频 编辑:刘一 责任编辑: ...,http://news.cctv.com/2019/05/31/VIDEUwTE5eoLyAvr1ek60sUh190531.shtml
华北黄淮等地将有高温天气 东北黄淮等地有强对流天气,新浪新闻,2019年06月03日,"预计6月3日08时至4日08时,吉林中南部、辽宁北部、山东南部、河南东部和南部、安徽北部、湖北北部等地的局地将有8-10级雷暴大风或冰雹天气;云南南部、广西西南部...",http://news.sina.com.cn/o/2019-06-03/doc-ihvhiqay3251820.shtml
最新天气:06月04日12时天气预报,中国天气网,2019年06月04日,"今天下午到夜里,黄河以北和三门峡、洛阳、郑州、开封、平顶山、南阳六地区多云,有分散性阵雨、雷阵雨,并伴有雷暴大风、短时强降水、冰雹等强对流天气;其它地区晴天...",http://www.weather.com.cn/henan/tqyw/06/3198820.shtml
江苏气温将重返30℃ 周末再次迎来晴好天气,人民网江苏频道,2019年05月30日,"还有一场雨的距离,江苏就会彻底切换成晴好升温模式了。5月30日,全省大部分地区有阵雨。受降雨影响,最高气温下降至22℃到25℃左右。5月31日,天气好转。6月1日...",http://js.people.com.cn/n2/2019/0530/c360302-32992213.html
德庆:气象灾害防御专题讲座深入重点防御单位,中国气象局,2小时前,"同时,气象专家还引导员工关注“德庆天气”微信,让员工更便捷了解最新气象资讯和天气情况。 讲座有助于提高企业气象灾害应急响应处置管理规范化水平,增强企业职工气象...",http://www.cma.gov.cn/2011xwzx/2011xqxxw/2011xjctz/201906/t20190605_526412.html
昆明:24个部门共商气象灾害预警服务,中国气象局,2小时前,"会议通报了近期天气气候情况,并对后期气候趋势进行预测,介绍了气象灾害预警信息发布机制和气象灾害防御部门联动情况。与会代表对气象灾害预警服务信息的使用情况进行了交...",http://www.cma.gov.cn/2011xwzx/2011xqxxw/2011xjctz/201906/t20190605_526413.html
中央气象台清晨发预警 安徽这些地方有大暴雨,新浪安徽站,2小时前,"月5日8时至6日8时,安徽中北部、河南南部等地部分地区有大到暴雨,其中河南南部、安徽西北部有大暴雨,雨量100~150毫米,并伴有短时强降水、雷暴大风等强对流天气...",http://ah.sina.com.cn/news/wltx/2019-06-05/detail-ihvhiews6832191.shtml
这两天冷涡系统坐镇 晴朗多云阵雨上演 端午节逢高考 或迎降雨 ...,和讯,3小时前,"这一周,冷涡系统始终盘踞在我们头上,天空的状况每天都在不断变化,云朵翻转移动,时不时地还来一阵雨,这也正是冷涡天气的特点,冷涡带来的雨通常会夹带急雨、大风...",http://news.hexun.com/2019-06-05/197422197.html
河北省气象局启动汛期气象服务响应预案,大众网,8小时前,"河北省气象局启动汛期气象服务响应预案河北新闻网讯(通讯员郭迎春、车少静。由于降水时空分布不均,天气气候状况总体复杂,气象预报预警及防汛抗旱工作任务艰巨,河北省...",http://www.dzwww.com/xinwen/shehuixinwen/201906/t20190605_18796516.htm
"“端午水”送考,气温宜人利凝神答卷---三湘都市报数字报刊",三湘都市报,2小时前,"本报6月4日讯 当高考遇上端午,长沙的天气会不会有点“燥”,让不少考生及家长担忧。好在“天公作美”,降雨即将前来“送考”。记者在今天长沙气象局召开的201...",http://epaper.voc.com.cn/sxdsb/html/2019-06/05/content_1392955.htm?div=0
5日夜里江苏迎大风大雨 6日气温将下降10℃,人民网江苏频道,2小时前,"6月5日白天,全省天气晴好,气温依然较高,淮北地区最高气温可达35～37℃。但从6月5日夜里开始,江淮气旋登场,受它影响,全省将有一次较强降水过程,并伴有陆上5-...",http://js.people.com.cn/n2/2019/0605/c360302-33011053.html
海丽气象吧丨37℃高温后山东连下两天雨 端午全国无大范围高温,人民网,29分钟前,"进入6月以来,山东的气温居高不下,很多小伙伴已经过上了“空调西瓜WIFI”的生活。开场这么“高”调,那么接下来天气如何呢?目前一波降雨已经抵达山东,持续多日的...",http://sd.people.com.cn/n2/2019/0605/c166192-33012164.html
"申城气象指数(6月5日)-阴到多云,相对湿度,温度,上海,雷雨,阵风,...",东方网,2小时前,"2019-6-5 07:16:36 来源:上海天气网 选稿:牛强 上海中心气象台2019年6月5日5时发布:多云到晴,今天夜里转阴到多云,明天阴到多云有阵雨或雷雨。东南风3-4...",http://sh.eastday.com/m/20190605/u1ai12564794.html
安徽省强降水今夜来袭 气温将有所下降,新浪安徽站,3小时前,"今天白天全省以晴到多云天气为主,气温依旧较高,淮北地区和皖南山区:34-36℃;其他地区:33-35℃。 不过过了今天高温天气就会暂时告一段落,今天夜里开始全省大部分...",http://ah.sina.com.cn/news/2019-06-05/detail-ihvhiqay3634898.shtml
芜湖市多个站点气温突破35℃,新浪安徽站,3小时前,"芜湖市多个站点气温突破35℃,本周连续数日晴热天气,气温陡然攀升,夏日气息浓郁。据统计,我市昨日多个站点突破35℃,然而今天夜里天气将突变,或迎来一场中雨,明日...",http://ah.sina.com.cn/news/2019-06-05/detail-ihvhiews6827433.shtml
6月5日气象钢报:大范围暴雨成交停滞,富宝资讯,43分钟前,"富宝钢市天气预报:今天白天,除沪杭等长江三角洲地区外,我国中东部大部分地区均有降雨,由于本轮降雨范围广、强度大,多地甚至达到大暴雨程度,国内钢材需求将明显萎缩...",http://www.f139.cn/news/detail/4491639.html
今天镇江气温依旧比较高 夜里开始会下雨,中国江苏网,1小时前,"具体天气预报:昨天夜里到今天白天全市晴转多云,今天夜里多云转阴有阵雨或雷雨,雨量中等,东南风3到4级,最低气温21℃到 22℃,最高气温35℃;6日全市阴有阵雨或雷...",http://jsnews.jschina.com.cn/zj/a/201906/t20190605_2322976.shtml
厦门5月雨天多近期气温高 蚊子进入繁殖活跃期,厦门网,1小时前,"“蚊子增加与天气变化,尤与雨水增多有关。”市疾控中心工作人员解释,蚊子喜欢20℃~27℃的温度,必须在水中繁殖。5月雨天多、持续降水,积水环境的数量明显增加;随着...",http://news.xmnn.cn/xmnn/2019/06/05/100546128.shtml
高考期间 气温挺给力 - 阜阳新闻 - 阜阳新闻网,阜阳新闻网,1小时前,"昨日又是一个“烧烤天”,全省大部气温持续高涨,不少地区最高气温超过36℃,我市最高气温甚至超过38℃。 今日白天,我市仍以高温天气为主,最低气温22～24℃,最...",https://www.fynews.net/article-175965-1.html
今日或迎降雨气温小幅下降,新华网河南站,1小时前,"降雨量:全省小到中雨;南阳、信阳、驻马店有大雨,局部暴雨,并伴有短时强降水、雷暴大风、冰雹等强对流天气,过程雨量30毫米～60毫米,局部地区80毫米～100毫米,最大...",http://www.ha.xinhuanet.com/news/2019-06/05/c_1124583998.htm
高考期间气温舒适无降水,南京日报,3小时前,"6月7日到9日高考期间,全市没有降水,以多云天气为主,其中7日最高气温只有27―28℃,8、9日最高气温在30℃左右。上一篇 下一篇 ...",http://njrb.njdaily.cn/njrb/html/2019-06/05/content_538102.htm?div=-1
河北省做好近期气象灾害防御工作 确保麦收、中高考顺利进行,新华网河北站,57分钟前,"通知强调,6月份我省短时强降水、雷电、冰雹、短时大风等强对流天气具有局地性强和突发性强的特点,各地各部门一定要高度关注气象部门发布的强对流天气预报预警信息,...",http://www.he.xinhuanet.com/xinwen/2019-06/05/c_1124584171.htm
安徽省气象台发布紧急提醒:合肥将迎大暴雨!8级大风!,万家热线,1小时前,"明天又要下雨了! 扩散提醒,出行注意安全!今日合肥天气阴转大雨 24-34℃ 南风。 原标题:合肥大暴雨!8级大风!气象台发布紧急提醒!【...",http://365jia.cn/news/2019-06-05/5A79D1988D941EF7.html
全国主要公路气象预报,中国气象局,2019年06月04日,"黑龙江南部、吉林中部、河北中部和南部、山东北部和中部、贵州西部、湖南中部、江西大部、广东中部和东部等地的部分地方可能有雷暴天气。另外,江苏东南部、上海、浙江...",http://www.cma.gov.cn/2011xwzx/2011xqxxw/2011xzytq/2011xqxgg/201906/t20190604_526405.html
第18次世界气象大会在日内瓦开幕,中国气象局,2019年06月04日,"据悉,WMO是联合国负责气象(天气和气候)、水文和相关地球物理科学的专门机构,总部设在日内瓦。世界气象大会是WMO的最高权力机构,每4年召开一次。在安道尔和瑙鲁加入后...",http://www.cma.gov.cn/2011xwzx/2011xqxxw/2011xqxyw/201906/t20190604_526406.html
森林火险气象预报_中国气象局,中国气象局,2019年06月04日,当前位置: 首页&gt;新闻资讯&gt;气象新闻&gt;重要天气&gt;气象公告 森林火险气象预报来源:中央气象台 发布时间:2019年06月04日17:55 分享到: ...,http://www.cma.gov.cn/2011xwzx/2011xqxxw/2011xzytq/2011xqxgg/201906/t20190604_526404.html
宁波:气象标准化建设助推服务提质增效,中国气象局,2019年06月04日,"近年来,宁波市气象局不断强化气象法治和标准化工作,将气象标准化工作作为助推防灾减灾和公共服务提质增效的重要途径,制定了行业标准《临近天气预报检验标准》,发布了3...",http://www.cma.gov.cn/2011xwzx/2011xgzdt/201906/t20190604_526358.html
荆州进入盛夏今日气温高达35℃ 明起将迎强降水,凤凰网,2019年06月04日,"另外,根据湖北省气象服务中心观测,预计6月5日～6日白天,我省自西向东将有一次强降水天气,并伴有雷电大风、冰雹等强对流,其中,鄂西北东部、鄂西南、江汉平原、鄂东...",http://news.ifeng.com/c/7nE8iH7yrkk
黄克磊:万里羌塘谱写气象人生新诗篇_中国气象局,中国气象局,2019年06月04日,黄克磊:万里羌塘谱写气象人生新诗篇,http://www.cma.gov.cn/2011zwxx/2011zdflz/2015qtgz/201906/t20190604_526354.html
广东雷雨活跃气温升 粤西和珠三角局地有暴雨,新浪新闻,2019年06月04日,"中国天气网讯今天(4日),预计广东粤西和珠江三角洲南部市县有中到大雨,局地暴雨,其余市县以多云天气为主,部分地区有雷阵雨。此外,近期广东雷雨活动比较频繁,气温...",http://news.sina.com.cn/o/2019-06-04/doc-ihvhiews6659033.shtml
【省气象局】出台方案 全力做好高考期间气象保障服务,新浪新闻,2019年06月04日,"为切实做好高考期间气象保障服务工作,近日,省气象局制定了《青海省气象局2019年高考气象保障服务方案》,要求加强强对流、灾害性天气预警,采取多种举措服务广大考生和...",http://news.sina.com.cn/c/2019-06-04/doc-ihvhiews6658524.shtml
七星关:调研特色农产品大白萝卜气象服务需求,中国气象局,2019年06月04日,"工作组通过与当地合作社负责人、高级农艺师余慧明深入交流,详细了解大白萝卜种植对气象服务的需求,立足实际,从天气趋势预报、农情气候实时监测、搭建平台指导农户科学种植...",http://www.cma.gov.cn/2011xwzx/2011xqxxw/2011xjctz/201906/t20190604_526326.html
新乡:气象执法事项纳入全市“互联网+监管”平台,中国气象局,2019年06月04日,"新乡市气象部门以权力清单为基础,全面梳理了气象设施和气象探测环境保护、行业气象台站、防雷装置检测单位监督检查、防雷安全检查、人工影响天气、施放气球活动、气象信息...",http://www.cma.gov.cn/2011xwzx/2011xqxxw/2011xjctz/201906/t20190604_526327.html
高温黄色预警 河南山东湖北等地局地气温冲击40℃,新华网,2019年06月04日,2019-06-04 08:22:55 来源: 中国天气网 关注新华网  微信 微博 Qzone  评论 图集  02020202020202中央气象台6月4日06时继续发布高温黄色预警:...,http://www.xinhuanet.com/yingjijiuyuan/2019-06/04/c_1210150815.htm
中央气象台新会商室投入运行,中国气象局,2019年06月04日,"步入会商室正门,中央气象台自主研发的高分辨率全球GRAPES数值预报产品,六万多个自动站数据,卫星、雷达等综合监测产品,全国预警信号分布情况,全国天气会商重点提示和应...",http://www.cma.gov.cn/2011xwzx/2011xgzdt/201906/t20190604_526335.html
阜新:建立应急管理与气象预测联动机制,中国气象局,2019年06月04日,"针对重大天气过程、节假日、大型活动等开展联合会商;建立预警信息发布机制,综合运用现代化手段和传统设备扩大预警信息覆盖面,做好预警与应急有效结合,提前部署防范;...",http://www.cma.gov.cn/2011xwzx/2011xqxxw/2011xjctz/201906/t20190604_526320.html
甘肃:精准气象服务助力兰州国际马拉松,中国气象局,2019年06月04日,"赛事当日,气象部门在赛道沿线布设7个移动气象站,从凌晨5时开始提供逐半小时赛程天气实况,每五分钟提供一次天气实况,通过电子显示屏、短信等向参赛选手和公众滚动发布...",http://www.cma.gov.cn/2011xwzx/2011xgzdt/201906/t20190604_526316.html
近期厦门午后阵雨多发 气温将稳定在30℃以上,凤凰网,2019年06月04日,"厦门网讯(海西晨报记者曾昊然通讯员其翔)昨天,厦门受强盛的西南气流影响,上午的时候阳光普照,感觉十分炎热;但是午后天气突变,天空乌云密布,出现了短时强降水和大风...",http://news.ifeng.com/c/7nDlPJHEp9e
胡豆大的冰雹夜袭内江自贡 - 每日更新 - 华西都市报,华西都市网,3小时前,"自贡荣县胡豆大的冰雹。内江的冰雹下得很密。 内江资中:冰雹砸得汽车“铛铛铛”响 4日22时45分,内江气象台发布冰雹短时临近天气...",http://news.huaxi100.com/index.php?m=content&c=index&a=show&catid=18&id=1019098
气象局:今年5月全国平均气温接近常年同期,中国法院网,2019年06月04日,"5月,我国共出现5次较大范围的暴雨天气过程:5-6日、12-13日、15-18日、19-20日和25-28日。5月15-18日,江南大部及福建等地过程降水量普遍超过25毫米,...",https://www.chinacourt.org/article/detail/2019/06/id/4001813.shtml
湖北省应急管理厅与省气象局签订联动工作机制框架协议,新华网,2019年06月04日,"他强调,应急管理工作和天气情况、气象服务工作息息相关,气象工作是应急管理工作的“第一道防线”,及时精准的气象服务是有效预防自然灾害、高效开展应急管理决策处置的...",http://www.xinhuanet.com/yingjijiuyuan/2019-06/04/c_1210151032.htm
我省发布地灾气象风险黄色预警 石棉、泸定两县需注意,四川省人民政府网,2019年06月04日,"6月3日,省自然资源厅发布全省地质灾害气象风险预警,结合四川省气象台天气预报情况,6月3日20时～6月4日20时,全省地质灾害气象风险预警等级为3级,即黄色预警。",http://www.sc.gov.cn/10462/12771/2019/6/4/92daea14c3114b45b3ea2b406a29ea8d.shtml
陕西省气象台继续发布高温橙色预警 西安明天将迎降水,中国广播网,2019年06月04日,"西安天气: 6月4日:多云间阴天,局地有阵雨;最高气温:38℃,最低气温:20℃,东北风2级;6月5日:阴天有小雨或阵雨,气温20～32℃;6月6日:阴天转多云,气温:19...",http://www.cnr.cn/sxpd/sx/20190604/t20190604_524639005.shtml
北京气象局发布雷电蓝色预警:多地区有雷阵雨,凤凰网,2019年06月04日,"中新网6月4日电 据北京市气象局网站消息,北京市4日9时发布雷电蓝色预警,预计9时至23时,北京市多地区自西向东将有雷阵雨天气,局地短时雨强较大,并伴有7级...",http://finance.ifeng.com/c/7nE7fOzw5BV
高温黄色预警 河南山东湖北等地局地气温冲击40℃,新浪新闻,2019年06月04日,"中国天气网讯 中央气象台6月4日06时继续发布高温黄色预警:预计6月4日白天,河南、山东大部、河北南部、山西南部、陕西关中地区、苏皖北部、湖北中西部、湖南中北部...",http://news.sina.com.cn/o/2019-06-04/doc-ihvhiqay3453316.shtml
广州日报数字报- 高考期间 闷热有雨,大洋网,5小时前,"预计高考及端午期间,气温逐渐回升,转趋闷热,天气仍然不稳定,有阵雨或雷阵雨。 东莞气象台提醒,今年高考期间,广东省气象局与省考试院、粤省事携手首次推出了全省...",http://gzdaily.dayoo.com/pc/html/2019-06/05/content_110732_609644.htm
印度多地遭热浪袭击 气温逼近50摄氏度,中国侨网,2019年06月04日,"在首都新德里,因气温达到47摄氏度,气象局发布极端天气红色警报。 近日,印度许多地区的气温逼近50摄氏度,接连不断热浪来袭触动了供水短缺的警告。据报道,印度气象局...",http://www.chinaqw.com/m/hqly/hd/2019/0604/6190.shtml
高温、雷、雨、冰雹…… 河南昨日气象万千,新浪河南,2019年06月04日,"6月3日,郑州天气骤变,傍晚7时,南部乌云压顶,西部云朵散去,太阳给天空染上美丽的晚霞,而东部的天空还出现了一点点彩虹。郑报全媒体记者 马健 图 中原网讯(郑报...",http://henan.sina.com.cn/news/m/2019-06-04/detail-ihvhiqay3454596.shtml
河南昨日多地雷电轰鸣下冰雹 今日局部气温超40度,新浪河南,2019年06月04日,"天气很不让人省心 高温、干热风、强对流、降水轮番上场  1、高温 、干热风  今日是我省近期气温最高的一天,淮河以北地区35℃+(北中部38-40,局部超过40度);...",http://henan.sina.com.cn/news/2019-06-04/detail-ihvhiqay3455460.shtml
秒变天 河南多地雷电轰鸣下冰雹 今日气温近期最高,新浪河南,2019年06月04日,"天气很不让人省心 高温、干热风、强对流、降水轮番上场 ↓↓↓ 1、高温 、干热风  今日是我省近期气温最高的一天,淮河以北地区35℃+(北中部38-40,局部超过...",http://henan.sina.com.cn/news/z/2019-06-04/detail-ihvhiews6602246.shtml?from=wap
"申城气象指数(6月4日)-相对湿度,多云,温度,上海,气象台,明天,级,...",东方网,2019年06月04日,"2019-6-4 07:15:42 来源:上海天气网 选稿:牛强 上海中心气象台2019年6月4日5时发布:多云到晴,明天多云。东南风3-4级,明天下午转4-5级。今天最高温度32...",http://sh.eastday.com/m/20190604/u1ai12561900.html
上海今天晴到多云为主 气温最高32℃最低20℃,东方网,2019年06月04日,"今天,申城依然是东南风,晴到多云为主的天气,气温会更高些,最高32℃,最低20℃。明天多云,最高也是32℃左右,最低气温进一步抬升到22℃左右。 对于申城来说,...",http://sh.eastday.com/m/20190604/u1ai12561715.html
国家防总:今年汛期我国气候状况总体偏差,新浪新闻,2019年06月03日,"国家防汛抗旱总指挥部办公室有关负责人表示,受全球气候变化影响,近年来极端天气气候事件明显增多,我国水旱灾害反常性、不可预见性凸显,常常多灾并发、重灾频发。 ...",http://news.sina.com.cn/c/2019-06-03/doc-ihvhiqay3404987.shtml
森林火险气象预报_中国气象局,中国气象局,2019年06月03日,当前位置: 首页&gt;新闻资讯&gt;气象新闻&gt;重要天气&gt;气象公告 森林火险气象预报来源:中央气象台 发布时间:2019年06月03日17:00 分享到: ...,http://www.cma.gov.cn/2011xwzx/2011xqxxw/2011xzytq/2011xqxgg/201906/t20190603_526303.html
山东今夏第二轮高温来袭 局地气温或超40℃,中国广播网,2019年06月03日,"从6月2日起,山东迎来今夏第二轮高温天气。山东省气象台16时继续发布高温黄色预警信号:预计今(2日)起直到5日,山东省大部地区将出现35℃以上的高温天气,聊城、...",http://www.cnr.cn/sd/yw/20190603/t20190603_524637118.shtml
印度多地气温逼近50摄氏度 政府发布红色预警,新浪新闻,2019年06月03日,"近日,印度多地遭遇连日高温。2日当天,印度最高气温达51.8摄氏度,另有多地气温逼近50摄氏度。针对连日高温,印度气象部门已发布当地级别最高的极端天气红色警报。...",http://news.sina.com.cn/w/2019-06-03/doc-ihvhiqay3328978.shtml
"唐山气象台发布雨情,这地雨最大!",凤凰网,2019年06月03日,"环渤海新闻网消息唐山气象台6月3日8时发布雨情:受高空槽影响,2日夜间我市大部分地区出现雷阵雨天气。 此次过程,全市平均降水量3.6mm,最大降水量为曹妃甸七农场...",http://news.ifeng.com/c/7nCSr7CydF7
河南气象服务夏粮颗粒归仓|气象局|夏粮|气象_新浪新闻,新浪新闻,2019年06月03日,"从河南省气象局获悉,预计5月24日-6月20日期间,河南省降水较常年同期偏少0-2成,无明显连阴雨天气过程。而对于豫南地区需根据近期天气情况对已成熟的麦田抓紧时间...",http://news.sina.com.cn/o/2019-06-03/doc-ihvhiews6472815.shtml
浙江:开展主题党日暨气象服务进海岛活动,中国气象局,2019年06月03日,"“现在的天气预报很及时、很准确,前阵子收到气象局的短信,说是会有一次强降温、降水过程,我就提早跑到田里做了防护。”从事黄金瓜种植二十多年的李忠洋,是地...",http://www.cma.gov.cn/2011zwxx/2011zdflz/dfdt/201906/t20190603_526247.html
