标题,来源,发布时间,简介,链接
天气,深圳晚报,3小时前,"今日天气 多云,有短时阵雨或雷阵雨;气温26℃~32℃;南风3级;相对湿度75%~95% 空气质量指数(AQI):30~50 PM2.5日均值:15微克/立方米 ...",http://wb.sznews.com/PC/content/201906/05/content_666184.html
今日天气,中国天气网,2019年05月07日,转载请注明“来源:中国天气网”。【收藏此页】【打印】 相关新闻焦点图片 高清图集  生活旅游 气候科普  夏天不注意这些 小心疾病缠上你! 手把手教你做出好喝又...,http://www.weather.com.cn/tianjin/tqyw/05/3187319.shtml
5月6日全国空气质量预报:西北地区多沙尘天气,东方网,2019年05月06日,"未来一周,新疆南疆盆地、青海柴达木盆地、甘肃西部、内蒙古西部等地的部分地区有扬沙或浮尘天气,全国其余大部地区大气扩散条件较好。",http://tianqi.eastday.com/news/56510.html
天气预报,东方网,2019年04月27日,"广西东北部等地的部分地区出现短时强降水,小时雨强20-50毫米,局地达80毫米以上;广东北部、福建南部等地的局地出现8-10级雷暴大风,甘肃东部等地局地出现冰雹天气...",http://tianqi.eastday.com/news/56174.html
全国天气:北方气温频繁波动 南方成降雨中心,东方网,2019年04月23日,"今天(23日)起,华南一带雨势减弱,降雨重心北推至贵州到江南一带,暴雨点分散,多短时强对流天气,并且一直到4月底前,江南华南都是雨水频繁。在北方,受冷空气影响,...",http://tianqi.eastday.com/news/55969.html
中国天气iPhone版查看全国天气预报的方法,太平洋电脑网,2019年04月22日,"打开中国天气客户端,进入客户端后用户可以为了方便定位,先允许访问位置权限,然后可以在选择城市页面中选取用户的当前城市,选择完成后就会进入该城市的天气情况。",https://g.pconline.com.cn/1250/12502584.html
全国天气:南方降水减弱 长江以北逐渐降温,东方网,2019年04月22日,"预计今(22日)明天,南方雨势整体减弱,降水重心北抬至江南一带。4月底前,江南、华南雨水频繁,并多伴随出现强对流天气,城乡积涝、山洪、山体滑坡、泥石流等次生灾害...",http://tianqi.eastday.com/news/55909.html
未来三天全国天气预报: 华南等地有强降雨和强对流,东方网,2019年04月21日,"等地的部分地区有大雨,其中广西北部、广东中部和东部、福建南部等地的局部地区有暴雨(50～80毫米),上述部分地区伴有短时强降水、雷暴大风或冰雹等强对流天气(见图...",http://tianqi.eastday.com/news/55883.html
[早安山东]天气情况20190417,央视网,2019年04月17日,[早安山东]天气情况20190417 发布时间:2019年04月17日 08:34 | 来源:央视网 | 手机看新闻 | 手机看视频 请点此安装最新Flash编辑:刘一 ...,http://news.cctv.com/2019/04/17/VIDEtFFvtWXUuAyK3HevQtNk190417.shtml
[福州新闻]天气预报,央视网,2019年04月14日,[福州新闻]天气预报 发布时间:2019年04月14日 20:56 | 来源:央视网 | 手机看新闻 | 手机看视频 编辑:刘一 责任编辑: 中央电视台网站|联系CCTV|关于CCTV....,http://news.cctv.com/2019/04/14/VIDEpDbjVb6m0E9Q5QNaAfc2190414.shtml
全国雾霾天气预报:4月14日广东中西部有大雾天气,东方网,2019年04月14日,"全国雾霾天气预报:14日至16日,受冷空气大风影响,新疆南疆盆地、内蒙古中西部、宁夏、陕西北部等地的部分地区有扬沙或浮尘天气。另外,14日早晨至上午,广东中西部...",http://tianqi.eastday.com/news/55602.html
"上一秒大暴雨,下一秒大太阳!贺州天气大变脸!还有一大波消息...",搜狐,2019年03月29日,"内容来源:中国天气网、贺州生活圈 政策  声明:该文观点仅代表作者本人,搜狐号系信息发布平台,搜狐仅提供信息存储空间服务。  阅读(951)  分享到  严重白发?水中...",http://www.sohu.com/a/304755520_713430
天气预报为何越来越准了?院士带你了解背后的故事,中国气象局,2019年03月25日,"未来的天气预报会如何发展?中国科学院大气物理研究所曾庆存院士给大家做出了解答。 预报准确率可达80% 曾庆存介绍,目前的3天预报,在全球范围可达70%至80%的准确度,...",http://www.cma.gov.cn/2011xwzx/2011xmtjj/201903/t20190325_518666.html
北京天气:未来四天连续升温 温度有望创年内新高,东方网,2019年04月01日,"今天(1日)北京天气晴好,气温继续上升,最高气温16℃。本周气温先升后降,前期快速升温,周四最高气温或达27℃,有望创今年来气温新高。清明节假期会有冷空气活动...",http://tianqi.eastday.com/news/55125.html
未来三天全国天气预报:华北轻度雾霾 华南仍将保持阴雨,东方网,2019年02月21日,"未来三天全国天气预报:华北中南部、黄淮大部、汾渭平原等地扩散条件较差,有轻至中度霾,河北中南部、河南北部和山东西部局地有重度霾;江淮南部、江南中东部、华南中...",http://tianqi.eastday.com/news/53602.html
未来三天全国天气预报:华北大降雪 南方多阴雨,东方网,2019年02月11日,"未来三天全国天气预报:11日夜间至14日,西北地区华北等地将有降雪天气。其中,11日夜间至12日,华北北部、辽宁南部等地有小雪,局地中雪。未来一周左右,江南、华南...",http://tianqi.eastday.com/news/53181.html
西江苗寨天气预报,天气网,2018年12月29日,"★天气网(m.tianqi.com)★ 凯里旅游天气频道提供凯里西江苗寨天气预报,提前预测西江苗寨天气预报一周、10天、15天查询。",http://www.tianqi.com/guizhoujingdian/18653/
天津30天天气预报,天气网,2018年12月19日,"天气网(www.tianqi.com)提供天津天气预报30天,天津未来30天天气查询,天津天气预报30天查询,天津未来一个月天气变化情况,气温走势,相对湿度,降水量预报查询,方便出行。",http://www.tianqi.com/tianjin/30
白龙湖天气预报30天,天气网,2018年11月19日,"天气网(www.tianqi.com)提供白龙湖天气预报30天,白龙湖未来30天天气查询,白龙湖未来一个月天气变化情况,气温走势,方便出行。",http://www.tianqi.com/guangyuan/blhjingdian/30/
吉林市人民政府,吉林市人民政府,2019年06月03日,"二、 本周天气预报 预计本周(6月3日～6月9日)全市气温正常,降水偏多。周平均气温为18.5℃左右,与常年同期18.7℃接近;降水量为30-35毫米左右,比常年同期22...",http://www.jlcity.gov.cn/wszl/jlsqxzx/xq_jcqxfw/201906/t20190603_573472.html
贺州天气预报40天,天气网,2018年11月05日,"贺州天气网提供贺州天气预报40天,贺州未来40天天气预报,通过贺州天气预报40天查询,及时了解贺州各地区未来40天的天气状况,温度,降水量,风向等。助您放心出行旅游。",http://www.tianqi.com/hezhou/40/
垦丁天气预报,天气网,2018年12月25日,"★天气网(m.tianqi.com)★ 屏东旅游天气频道提供屏东垦丁天气预报,提前预测垦丁天气预报一周、10天、15天查询。",http://www.tianqi.com/taiwanjingdian/18947/
邹城市人民政府 通知公告 气象信息,邹城政务网,2019年05月26日,"气象信息:济宁市气象台2019年5月26日22时55分发布雷电黄色预警信息。预计今天夜间,我市大部地区将出现雷雨天气,雷雨时阵风7-8级,局部地区伴有短时强降水和冰雹,...",http://www.zoucheng.gov.cn/art/2019/5/26/art_24178_1499844.html
今起5天气温连续30℃+ - 社会 - 全景山东 - 鲁网,山东新闻网,2019年05月15日,"经历了上周末的降雨过后,省城济南在晴朗天气中迎来新的一周。受冷空气影响气温短暂波动,天气格外舒适宜人。不过,升温是本周天气的“主旋律”,周二至周六的最高...",http://sd.sdnews.com.cn/jinan/sh/201905/t20190515_2554669.htm
成都本次降温降雨趋于结束 “五一”假期气温还要降,四川新闻网,2019年04月29日,"本次降温降雨趋于结束,预计今日起至本周三,我市都是多云间晴天气为主,气温在19℃至26℃之间;“五一”假期除了第一日天气较好外,之后可能都是雨水相伴,可能将一直...",http://scnews.newssc.org/system/20190429/000961482.html
全国主要公路气象预报,中国气象局,2019年04月27日,"安徽、江西南部、广西东北部、广东中北部、贵州西部等地局地有雷暴大风等短时强对流天气。另外,山东东部和北部、河北中南部、山西北部、陕西南部等地局地有雾。 ...",http://www.cma.gov.cn/2011xwzx/2011xqxxw/2011xzytq/2011xqxgg/201904/t20190427_523189.html
应急管理部发布2019年一季度全国自然灾害情况,中国气象局,2019年04月08日,"其主要特点是:强对流天气引发的风雹灾害较常年偏早,影响持平;地质灾害和森林火灾突发,造成重大人员伤亡;地震活动总体水平不高,四川、青海地震造成一定损失;低温冷冻...",http://www.cma.gov.cn/2011xwzx/2011xqxxw/2011xqxyw/201904/t20190408_519831.html
文登传媒网 ― 气象日里学气象,文登网,2019年03月24日,"文登传媒网讯 3月23日是第59个“世界气象日”,今年的主题是“太阳、地球与天气”。文登区广播电视台少儿艺术团组织部分学员走进区气象局,参观气象站,学习气象科普...",http://www.wendeng.sd.cn/contents/3/5930.html
气象科技成果看得见摸得着,中国气象局,2018年12月11日,"大学时期,在掌握了《天气学原理》《气候学》《动力气象学》等学科知识后,我还选修了生物学、化学等。在不断丰富自身知识的过程中,我尝试做交叉学科的研究,并对...",http://www.cma.gov.cn/2011xzt/2018zt/20180917/2018091710/201812/t20181211_485548.html
人民日报:应对气候变暖 还需持续攻坚,人民网,2018年12月08日,"2018/2019年冬季(2018年12月―2019年2月),全国大部地区气温较常年同期偏高;东亚冬季风偏弱,影响我国的冷空气弱,我国北方地区静稳天气发生概率较高,污染物扩散...",http://env.people.com.cn/n1/2018/1208/c1010-30450938.html
地图版国内城市天气预报,东北新闻网,2018年08月08日,天气现象 风向风力 最高气温 天气现象 风向风力 最低气温 沈阳 沈阳 晴 西北风 3-4级 27 晴 西南风 3-4级 14 详情 浑南 晴 西北风 3-4级 27 晴 西南...,http://liaoning.nen.com.cn/system/2013/12/31/011679016.shtml
"【贺州天气】贺州天气预报,天气预报一周,天气预报15天查询",中国天气网,2014年07月28日,"中国天气网提供【贺州天气预报】,一周,15天查询,40天查询,气象云图,空气质量,天气实况,温度,降水,风力,气压,紫外线等及时准确发布,是中央气象台唯一权威天气发布...",http://www.weather.com.cn/weather15d/101300701.shtml
图解天气,中国天气网,2013年08月02日,"“真热”的日子既有“烧烤”型,又有“蒸焖”型,就是我们常说的干热型和闷热型高温天气。5月22日至25日北京将迎来今年首次高温天气过程,属于哪一种类型呢?...",http://www.weather.com.cn/life/tjtq/index.shtml
鄂伦春天气预报30天,天气网,2017年11月10日,"天气网(www.tianqi.com)提供鄂伦春天气预报30天,鄂伦春未来30天天气查询,鄂伦春未来一个月天气变化情况,气温走势,方便出行。",http://www.tianqi.com/elunchun/30/
"【贺州天气】贺州天气预报,蓝天,蓝天预报,雾霾,雾霾消散,天气预报...",中国天气网,2008年07月26日,"蓝天预报综合天气现象、能见度、空气质量等因子,预测未来一周的天空状况。 天空蔚蓝 可见透彻蓝天,或有蓝天白云美景。 天空淡蓝 天空不够清澈,以浅蓝色为主。 天空...",http://www.weather.com.cn/html/weather/101300701.shtml
西峡天气预报30天,天气网,2017年11月10日,"天气网(www.tianqi.com)提供西峡天气预报30天,西峡未来30天天气查询,西峡未来一个月天气变化情况,气温走势,方便出行。",http://www.tianqi.com/xixia/30/
宁南天气预报30天,天气网,2017年11月10日,"天气网(www.tianqi.com)提供宁南天气预报30天,宁南未来30天天气查询,宁南未来一个月天气变化情况,气温走势,方便出行。",http://www.tianqi.com/ningnan/30/
岷县天气预报30天,天气网,2017年11月10日,"天气网(www.tianqi.com)提供岷县天气预报30天,岷县未来30天天气查询,岷县未来一个月天气变化情况,气温走势,方便出行。",http://www.tianqi.com/minxian/30/
宽甸天气预报30天,天气网,2017年11月10日,"天气网(www.tianqi.com)提供宽甸天气预报30天,宽甸未来30天天气查询,宽甸未来一个月天气变化情况,气温走势,方便出行。",http://www.tianqi.com/kuandian/30/
罗山天气预报30天,天气网,2017年11月10日,"天气网(www.tianqi.com)提供罗山天气预报30天,罗山未来30天天气查询,罗山未来一个月天气变化情况,气温走势,方便出行。",http://www.tianqi.com/luoshan/30/
罗山天气预报30天,天气网,2017年11月10日,"天气网(www.tianqi.com)提供罗山天气预报30天,罗山未来30天天气查询,罗山未来一个月天气变化情况,气温走势,方便出行。",http://www.tianqi.com/luoshan/30/
国内天气预报,中国天气网,2017年01月26日,"中国天气网为您提供实时全国天气气象信息,及时发布天气预报、灾害预警、气象云图、旅游天气、台风、暴雨雪等气象信息,为我国的生产生活提供全面精确的气象服务",http://www.weather.com.cn/static/html/weather.shtml
中东部有较强降水过程 黄淮江汉等地高温天气减弱,北青网,41分钟前,"南部、四川盆地东北部、华北南部、江汉、江淮、黄淮西部和南部、江南北部等地将先后有大到暴雨,部分地区有大暴雨,局地伴有短时强降水、雷暴大风或冰雹等强对流天气...",http://news.ynet.com/2019/06/05/1865527t70.html
闷热天气阵雨“突袭” 出门带上雨伞防淋湿,南宁晚报,3小时前,"今年高考碰上端午节,就南宁来说,6―9日多阵雨天气,总体上比较闷热,不时有阵雨送来清凉,为了不被雨淋感冒,大家出门最好带把伞。 昨日上午,广西没有明显降雨出现...",http://www.nnwb.com/html/2019-06/05/content_360169.htm
高考期间 “考点天气”每天两报,信息时报,8小时前,"信息时报,高考期间 “考点天气”每天两报 气象部门提醒:停课预警信号不适用于高考... 记者关注“广东天气”微信公众号查看“高考天气”,页面立即出现“广州地区”各高...",http://epaper.xxsb.com/html/content/2019-06/05/content_830752.html
天公作美 高考天气不“高”“烤”,燕赵晚报,2小时前,"本报讯(记者 马冬胜)6月7日将迎来高考日,这几天天气会不会“高”“烤”呢?据省气象台预报,未来三天我省天气凉爽,中南部最高气温不会超过33℃。不过,雷阵雨...",http://yzwb.sjzdaily.com.cn/html/2019-06/05/content_1948087.htm
天气预报将精确到考点,大洋网,4小时前,"广州日报讯 (全媒体记者叶卡斯 通讯员杨群娜、粤考宣)今年高考期间广东天气预报将首次精细到全部470多个考点。广东省气象台首席预报员伍志方透露,高考期间广东天气...",http://gzdaily.dayoo.com/pc/html/2019-06/05/content_110753_609756.htm
6月5日天气预报 - 连云港12345在线,中国连云港政府门户网,47分钟前,"趋势天气:6日阴有阵雨或雷雨,雨量中到大,东北风转西北风5到6级阵风7级,气温18℃到23℃;7日多云转晴,偏南风3到4级,气温19℃到28℃; 连云港海区:今天白天...",http://www.lyg.gov.cn/lygszcg/bmzx/content/2f8a0a05-3514-4445-be0d-0f4975255f2d.html
强对流天气即将到来  - 石家庄日报社数字报,石家庄日报,2小时前,"市气象局监测显示,6月4日夜间到5日,白天多云转阴,有雷阵雨或阵雨,22℃-26℃,东北风3-4级,雷雨时伴有短时强降水等强对流天气,提醒市民注意防范。5日夜间到6...",http://sjzrb.sjzdaily.com.cn/html/2019-06/05/content_1947943.htm
高考期间天气复杂多变 考生须注意防雨,南宁日报,3小时前,"本报讯(记者陈媚 通讯员杨金娇)广西招生考试院6月4日发布提醒信息,根据自治区气象局决策气象服务中心6月2日作出的2019年普通高考期间天气趋势预报,普通高考期间,...",http://www.nnrb.com.cn/html/2019-06/05/content_360118.htm
470个考点天气如何?广东首推预报服务,新快报,6小时前,"今年高考期间广东省天气闷热,易发雷雨天气 新快报讯 记者许力夫 通讯员杨群娜 粤考宣报道 高考即将到来,天气情况是考生和家长都很关心的事情。为做好2019年高考...",http://epaper.xkb.com.cn/view/1138945
大连天气,大连日报,9小时前,大连天气 2019年06月05日 大连日报数字报 大连新闻网... 大连天气2019-06-05 更多 今天:17℃～27℃ 多云转阴有雨 相对湿度:40%～100% 偏北风4～5级转偏东风...,http://szb.dlxww.com/dlrb/html/2019-06/05/content_1504272.htm?div=-1
甘肃河东4日至5日有明显降水天气 部分地方有暴雨,新华网甘肃站,34分钟前,"甘肃河东4日至5日有明显降水天气 部分地方有暴雨 ---最近天气反复“变脸”,兰州市周一气温超过30摄氏度,显现出些许夏天的迹象,今天就遭遇“打折”。6月6日夜间...",http://www.gs.xinhuanet.com/news/2019-06/05/c_1124584583.htm
【央视关注】高温下线雨水上线 未来三天我国天气多变,新浪新闻,2019年06月04日,"据CCTV-13新闻频道《24小时》报道:5G商用牌照即将发放,我国将正式进入5G商用元年。当前,全球5G正在进入商用部署的关键期。坚持自主创新与开放合作相结合,我国5G产业...",http://news.sina.com.cn/c/2019-06-04/doc-ihvhiqay3589481.shtml
印度遭遇高温天气 多地逼近50度,中华网,2019年06月04日,"印度遭遇高温天气 当地时间6月3日,印度,高温持续来袭。针对连日高温,印度国家气象局发布高温预警,预计高温天气还将持续几天,建议民众不要在最热的时段出门,以防...",https://news.china.com/socialgd/10000169/20190604/36331120.html
强对流天气蓝色预警+高温黄色预警 未来三天天气多变,新浪新闻,2019年06月04日,"来源:央视网 央视网消息:中央气象台预计,未来三天,西南地区东部、黄淮、江南等地将出现较强降雨,并伴有短时强降水、雷暴大风等强对流天气。中央气象台今天继续发布...",http://news.sina.com.cn/c/2019-06-04/doc-ihvhiqay3538190.shtml
重庆迎高温天气 民众“冰屋”内消暑,网易,2019年06月04日,"6月3日,重庆迎来高温天气,一游乐园内的各种冰雕吸引不少游客参观,体验“冰火两重天”的感觉。",http://news.163.com/photoview/00AP0001/2302079.html
渐趋炎热 高考/端午期间天气预报来了,新浪新闻,2019年06月04日,"高考即将开始,天气情况是考生和家长都很关心的事情。今年高考期间,受副热带高压及其边缘影响,广东省气温逐渐回升,转趋闷热,天气仍然不稳定,部分市县易发雷雨,但无...",http://news.sina.com.cn/o/2019-06-04/doc-ihvhiews6723233.shtml
北京今日天气凉爽最高温27℃ 有雷阵雨需带雨具,新浪新闻,2019年06月04日,"原标题:北京今日天气凉爽最高温27℃ 有雷阵雨需带雨具 新京报快讯 据北京市气象局官方微博消息,北京市气象台6时发布:今天白天阴天间多云,有雷阵雨,北转东风二三...",http://news.sina.com.cn/c/2019-06-04/doc-ihvhiqay3449574.shtml
美国恶劣天气频频 中部多地遭遇洪水袭击,新浪新闻,2019年06月04日,"据央视新闻消息近期,美国中部地区频遭恶劣天气袭击,密苏里州、俄亥俄州、俄克拉何马州、阿肯色州等地受灾。据美国媒体报道,暴雨、龙卷风和洪水等灾害已造成数十人死伤...",http://news.sina.com.cn/c/2019-06-04/doc-ihvhiqay3451424.shtml
"端午节+高考天气预报来了,还有件事赶紧了解...",澎湃新闻,2019年06月04日,"省气象部门发布消息,预测7日、8日高考期间,我省大部分地区天气仍不稳定,将有较为明显的降雨过程,午后雨势较大,部分市县雨量较大。阵雨天气听起来,没有前段时间...",http://www.thepaper.cn/newsDetail_forward_3601230
高温天气下新疆吐鲁番邀客商走进瓜地 向海内外推介哈密瓜,新浪新闻,2019年06月04日,"全国各地客商走进鄯善县哈密瓜种植户刘广林瓜地了解哈密瓜销售情况。王小军摄中新网鄯善6月4日电(王小军杨立媛)4日,高温天气下,新疆吐鲁番邀客商走进火焰山下鄯善县...",http://news.sina.com.cn/o/2019-06-04/doc-ihvhiqay3598148.shtml
范加尔:曼联5600万最废引援?他毁于天气和文化,新浪体育,2019年06月04日,"迪玛利亚当时在适应英格兰足球文化和英格兰天气时遇到了问题。你不能在买到球员的时候就知道他能带来什么样的表现。你无法预知,因为足球是一项团队运动。” “我总是...",http://sports.sina.com.cn/g/pl/2019-06-04/doc-ihvhiqay3485924.shtml
[超级新闻场]消防提醒:天气湿热 注意蛇出没,央视网,2019年06月04日,[超级新闻场]消防提醒:天气湿热 注意蛇出没 发布时间:2019年06月04日 08:56 | 来源:央视网 | 手机看新闻 | 手机看视频 编辑:刘一 责任编辑: ...,http://news.cctv.com/2019/06/04/VIDENs0YGrFGf5zwvyEXjgMp190604.shtml
明天最高37℃ 后天有大风暴雨 端午假期江苏全省天气以多云为主,华夏经纬,2019年06月04日,"周三后半夜至周四,全省将有一次明显降水过程,并伴有雷电、 大风等强对流天气。不过端午假期天气还是比较稳定的,7日至9日,江苏大部分地区都以多云为主。 6日沿江...",http://www.huaxia.com/js-tw/jsxw/2019/06/6127003.html
[北京您早]首都机场发布雷雨天气安检提示,央视网,2019年06月04日,[北京您早]首都机场发布雷雨天气安检提示 发布时间:2019年06月04日 09:32 | 来源:央视网 | 手机看新闻 | 手机看视频 编辑:刘一 责任编辑: ...,http://news.cctv.com/2019/06/04/VIDElZ6gRGbFXf5JsVUOK06F190604.shtml
暴雨+冰雹?广元六月的天气总是让你措手不及,四川在线,2019年06月04日,"6月4日下午,记者从广元市气象台获悉,从今晚上起,当地将有有一次暴雨+冰雹的雷阵雨天气过程,让你感受一下六月天气的措手不及。 根据预报信息显示,预计4日午后开...",https://sichuan.scol.com.cn/ggxw/201906/56992964.html
安庆:高温过后会迎来雷雨天气,新浪安徽站,2019年06月04日,"安庆:高温过后会迎来雷雨天气,本周的天气有点“调皮”,高温和降雨交替进行。气温方面,未来几天最高气温保持着3字头,体感偏热,提醒市民出门要注意补水和防晒,日常...",http://ah.sina.com.cn/news/wltx/2019-06-04/detail-ihvhiews6683831.shtml
"当高考遇上端午,你必须了解未来几天宁夏的天气!",新浪新闻,2019年06月03日,激动的心颤抖的手端午假期走一走假期来临之前各位伙伴肯定想问近期天气如何?快来听发布君说一说吧整体来看天气已经做好了“恭迎”假日的准备本周起冷空气暂告一...,http://news.sina.com.cn/o/2019-06-03/doc-ihvhiqay3367687.shtml
华北黄淮等地将有高温天气 华南等地有较强降雨,中国青年网,2019年06月03日,"6月3日电据中央气象台网站消息,6月3日至5日,华北南部、黄淮、陕西南部以及新疆南疆盆地等地的部分地区将陆续出现35～40℃的高温天气。6月2日20时至3日20时,...",http://news.youth.cn/gn/201906/t20190603_11971561.htm
敦化突现震撼天气像“黑洞”,新浪新闻,2019年06月03日,"据吉林省气象服务中心官方微博的消息,5月31日傍晚时分,吉林省敦化地区境内出现了震撼的天气现象。从拍摄的照片上看,当地的天空中出现了巨大的漩涡状云层,形成了...",http://news.sina.com.cn/o/2019-06-03/doc-ihvhiews6443721.shtml
"端午恰遇高考,江苏的天气挺给力",新浪新闻,2019年06月03日,"扬子晚报讯(记者 于丹丹)本周将迎来端午假期,还有备受关注的高考。从江苏省气象台提供的未来一周天气预测看,在端午节前,也就是5日夜间至6日白天,江苏有一场较...",http://news.sina.com.cn/o/2019-06-03/doc-ihvhiqay3250898.shtml
山西持续高温少雨天气,新浪新闻,2019年06月03日,"原标题:山西持续高温少雨天气 上周我省平均降水量为0.6毫米,较常年同期偏少9成;全省平均气温为20.4℃,较常年同期偏高0.3℃。虽然本周前期我省以晴热高温...",http://news.sina.com.cn/c/2019-06-03/doc-ihvhiqay3239988.shtml
高考期间达州天气晴雨相伴 考生需注意防暑降温,四川新闻网,2019年06月04日,"四川新闻网达州6月4日讯(记者 余开洋)一年一度的高考即将拉开大幕,高考期间的天气状况广大考生和家长较为关注。四川新闻网记者从达州市气象部门获悉,从目前预报...",http://scnews.newssc.org/m/system/20190604/000970097.html?ivk_sa=1023197a&ivk_sa_s=130828
合肥高温突破33℃ 一波降雨天气正在快马加鞭赶来,新浪安徽站,2019年06月04日,"合肥高温突破33℃ 一波降雨天气正在快马加鞭赶来,近段时间,炎热阳光天气是我市的主旋律,不断升高的温度,也让我们着实头痛不已,宁愿窝在家里开着空调不动弹,也...",http://ah.sina.com.cn/news/wltx/2019-06-04/detail-ihvhiqay3445855.shtml
