标题,来源,发布时间,简介,链接
高温天气袭击湖北 明日又将遭遇大到暴雨,中国天气网,2019年06月04日,"中国天气网湖北站讯:昨天(6月3日),湖北省受到了高温、冰雹、雷电天气的多重考验,今天全省大范围的高温天气持续,但明天,湖北自西向东将遭遇新一轮强降雨袭击,...",http://www.weather.com.cn/hubei/tqxs/06/3198835.shtml
高考期间全疆天气预报,中国天气网,2019年06月04日,"预计2019年高考期间(6月5-9日) 全疆各考点以多云天气为主,有时有阵雨,气温适宜,风力不大,气象条件对高考较为有利。 5日白天至夜间,伊犁州、塔城地区以及...",http://www.weather.com.cn/xinjiang/xjsy/tqyw/3198818.shtml
调侃天气热的搞笑说说 微信朋友圈表达天气热的搞笑句子,太平洋电脑网,2019年06月04日,"6.天气热得象蒸笼,人都快变成包子了。 7.今天上班路上不小心摔了一跤,被医院确诊为三级烫伤。 8.这年头秀恩爱已经不可耻了,最可耻的就是秀空调了…… 9.我...",https://pcedu.pconline.com.cn/1264/12645612.html
正在阅读:2019天气热的说说大全 表示天气很热心情说说,太平洋电脑网,2019年06月04日,"27.这个天气约你出去吃饭的,一定是生死之交,谈的肯定都是终身大事!  28.铁拐李:我这葫芦里卖的什么药?全是风油精,谁抹谁的身上冒凉风。 相关...",https://pcedu.pconline.com.cn/1264/12645678.html
白天天气闷热 晚上局部有强对流天气,中国天气网,2019年06月04日,"今天晚上,百色、河池、柳州、来宾、防城港、钦州等市的部分地区有中到大雨,局部有暴雨到大暴雨,并伴有短时雷雨大风等强对流天气,其它地区多云有阵雨,局地大雨。 ...",http://www.weather.com.cn/guangxi/tqxs/06/3198785.shtml
如天气晴好 夏至可用肉眼欣赏天上“马拉松”,中国天气网,2019年06月04日,"夏至前后的几天,国际空间站将频繁漫步天空,对于北半球中纬度地区的人们来说,如果天气晴好,可用肉眼欣赏这难得的天上“马拉松”。作者: 12_anhui 转载请注明“来源...",http://www.weather.com.cn/anhui/tqyw/06/3198696.shtml
"高考恰遇端午,泸州天气给力",中国天气网,2019年06月04日,"2019年高考即将拉开帷幕,恰遇端午节,可是在高考前几天泸州天气晴好,最高气温将上升到36度以上,4日晚有次中到大雨天气过程,并伴有雷电、短时阵性大风等强对流...",http://www.weather.com.cn/sichuan/tqyw/06/3198676.shtml
今天白天各地晴好天气 夜间有降雨来袭,中国天气网,2019年06月04日,"一、天气实况 昨日我市各地晴到多云;气温14~38℃,开州、巫山、彭水、奉节等4个区县最高气温超过37℃,开州最高38.3℃。 二、天气预报 4日白天,各地晴转多云;...",http://www.weather.com.cn/chongqing/qxfwcp/qhybh/06/3198663.shtml
雨水将至 贵阳高考天气“喜忧参半”,中国天气网,2019年06月04日,"今年的高考正赶上“端午节”,而贵阳的天气可谓“喜忧参半”,在雨水送清凉的同时,广大考生也需注意防范7日夜间出现的强降水可能造成的影响。 2017年交警冒雨指挥...",http://www.weather.com.cn/guizhou/gzsy/tqyw/06/3198662.shtml
今日天气,中国天气网,2019年06月04日,转载请注明“来源:中国天气网”。【收藏此页】【打印】 相关新闻焦点图片 高清图集  生活旅游 气候科普  夏天不注意这些 小心疾病缠上你! 手把手教你做出好喝又...,http://www.weather.com.cn/tianjin/tqyw/06/3198654.shtml
"要风有风,要雨有雨,要雷有雷 最近天气相当复杂",大众网,2019年06月04日,最近天气相当复杂是不是感觉这几天青岛天气比较稳定。在接受一长串复杂天气预报之前先一起来看看今天的天气稍微一缓……青岛市气象台3日16时发布【青岛市区】今天...,http://www.dzwww.com/shandong/sdnews/201906/t20190604_18792615.htm
"晨间天气丨今天又是大晴天,最高36℃",上游新闻网,2019年06月04日,"晨间天气丨今天又是大晴天,最高36℃06-04 07:00:00 来源:上游新闻综合分享到微博分享到微信分享到QQ 重庆市气象台4日6:30发布消息,主城今天8-14时,晴,25-...",https://www.cqcb.com/hot/2019-06-04/1662702_pc.html
快讯!预计16:00首都机场再迎来雷雨天气 通行能力下降25%,北青网,2019年06月04日,"首都机场预计今日(6月4日)16点起再次迎来雷雨天气,预计持续至20点。受其影响,首都机场通行能力将下降25%。 华北空管局于15点15分,再次启动大面积航班备降保障...",http://news.ynet.com/2019/06/04/1864843t70.html
"广州最近仍多雷雨,天气渐趋炎热 昨天最高气温32℃",金羊网,2019年06月04日,"记者许力夫报道 昨天最高气温32℃,预计本周天气渐趋炎热,间中有雷雨。预计,4日-6日广州市天气仍不稳定,雷雨频繁,局部地区可达大雨或暴雨,雷雨时伴有7-8级阵风;...",http://news.ycwb.com/2019-06/04/content_30272024.htm
"气象局:端午与高考期间华北平原与中国西北地区天气炎热,提醒考生...",界面新闻,2019年06月04日,"中国气象局于2019年6月4日召开新闻发布会,中国气象局应急减灾与公共服务司司长张祖强介绍称,端午假期和高考期间,华北平原、新疆东部、甘肃西部、内蒙古西部等地天气较...",http://www.jiemian.com/article/3187730.html
"QQ个性签名- 天气冷得像个笑话,日子过得像句废话。",太平洋电脑网,2019年06月04日,"正在阅读:QQ个性签名- 天气冷得像个笑话,日子过得像句废话。QQ个性签名- 天气冷得像个笑话,日子过得像句废话。 2019-06-04 12:20 出处:kanqq 作者:佚名 ...",https://pcedu.pconline.com.cn/1264/12646091.html
遇到暴雨天气 新能源汽车该注意哪些,车质网,2019年06月04日,"在下雨天气,安全起见尽量避免使用新能源汽车,如非使用不可也需要提高使用的安全意识。 雨天使用新能源电动车的注意事项: 1,雨季行车前应先做好行车前检查,主要检查...",http://www.12365auto.com/news/20190604/393629.shtml
中国气象局发布端午及高考期间天气预报,科学网,2019年06月04日,"主要天气过程:5-6日,西南地区东部、江汉、黄淮南部、江淮、江南北部、广西北部等地先后有大到暴雨,其中江汉、江淮等地的部分地区有大暴雨;华北、东北地区等地有...",http://news.sciencenet.cn/htmlnews/2019/6/427129.shtm
印度遭遇高温天气 多个城市已水资源匮乏,川北在线,2019年06月04日,"原标题:印度遭遇高温天气 多个城市已水资源匮乏 这两天,我国北方在晴朗天气和干热气团的影响下开启了高温热浪天气,6月2日,我国华北平原局地气温达到了40度以上...",http://www.guangyuanol.cn/news/shehui/2019/0604/966618.html
6.5江苏天气,江苏网络广播电视台,2019年06月04日,"明天白天,好天气继续,热力不减。淮北地区的高温还将持续。 荔枝网新闻频道,即时为您播报最新、最全、最热的新闻资讯,涵盖江苏、国内、国际、社会等热点内容。",http://news.jstv.com/a/20190604/1559647776690.shtml
"黄网【青州天气】青州天气预报,一周、15天、30天青州天气预报查询",湖北足球网,2019年06月04日,"黄网【青州天气】青州天气预报,一周、15天、30天青州天气预报查询 湖北足球网 2019年06月04日 19:10  时间过得真快,2019年一到,也意味着最早的一批“90后”...",http://www.hubeifc.com/tags.php?20190604505
"今明两天雷雨频繁,再坚持一天将迎来凉爽天气!",济南网络广播电视台,2019年06月04日,"明天傍晚到6日,还有一次降水天气过程――雷阵雨转小雨,频繁的降水直接浇灭了高温,6日最高气温26℃左右。 这几天总有人在问高考天气 今天我们就提前给大家剧透一波...",http://news.ijntv.cn/jn/jnms/2019-06-04/459008.html
随时查询考点天气!广东2019年高考象预报服务精细到全省470个考点,南方网,2019年06月04日,"为做好 2019 年高考服务,今天上午,广东省气象局和省教育考试院首次联合召开新闻发布会,发布高考天气情况及获取渠道、暖心高考准备情况。",http://www.southcn.com/economy/e/2019-06/04/content_187849246.htm
"本周3-5日高温晴热天气维持,适宜收晒,中期有明显降水利于夏播",中国财经新闻网,2019年06月04日,"上周天气回顾与影响上周依旧持续晴热少雨天气。周平均气温23.6度,同比偏低0.1度。周末(6月1-2日)出现了高温热浪天气,2日最高气温达38.8度,创入夏以来新高...",http://www.prcfe.com/news/2019/0604/353221.html
天气晴热 最高气温攀升,苏州新闻网,2019年06月04日,"昨天,苏州受高气压的影响,天气晴热,在太阳的加热下,白天气温一路快跑,明显回升。昨天早晨的最低气温还只有19.3℃,中午时已经接近了30℃,截至下午3时,最高气温...",http://www.subaonet.com/2019/0604/2477784.shtml
威海6月7-8日天气预报:2019高考期间威海天气怎么样,新东方在线,2019年06月04日,"威海6月7-8日天气预报:2019高考期间威海天气怎么样已经公布,新东方在线高考网整理了威海天气概况,供考生和家长朋友们参考",https://news.koolearn.com/20190604/1177274.html
考生注意!高考两天注意防范雷雨天气,丽水网新闻,2019年06月04日,"6月7-8日高考期间,我市以阵雨或雷雨天气为主,最低气温22℃左右,最高气温27-28℃,不冷也不热,适合广大考生发挥。 初夏时节,丽水花开满城。图为市区中山街上一...",http://news.lsnews.com.cn/sh/201906/t20190604_202210.shtml
巢湖市高考期间天气预报!,安徽网,2019年06月04日,"再过两天,我们就迎来端午小长假啦,尤其对高三学生来说冲刺完这周就:“解!放!啦!” 那么,本周巢湖的天气如何呢?巢湖市气象局发布了未来几天的天气情况:",http://www.ahwang.cn/chaohu/news/20190604/1881394.shtml
北京最新天气预报:今日还有一波降雨 未来三天最高温不超31℃,北晚新视觉,2019年06月04日,"北京市气象台首席预报员赵玮介绍,受高空槽的影响,今天早上,本市自西向东出现了一次雷阵雨的天气,到11时主要的雨区位于本市东部,西部已经是多云的天气,预计今天午后...",https://www.takefoto.cn/viewnews-1806367.html
今年高温天气来得比较早 潍坊市民急着买空调,凤凰山东站,2019年06月04日,"6月3日,热浪滚滚,最高温度达到35℃。记者当天走访了解到,今年高温天气来得比较早,提前催热了“高温经济”。其中,西瓜等消暑水果销量猛增,空调安装工连轴转,大桶水...",http://sd.ifeng.com/a/20190604/7485854_0.shtml
"高考恰逢“龙舟水”,气象局提醒考生及时掌握天气情况",南方网,2019年06月04日,"昨日,记者从市气象局获悉,未来几天强降水和强对流天气将持续影响肇庆市,有关部门须注意防御强雷电、超时大风、强降水及其引发的城乡积涝、局地山洪、山体滑坡等次...",http://zq.southcn.com/content/2019-06/04/content_187843897.htm
天气信息:未来几天 晴雨相间 雷雨送清凉,新华网天津站,2019年06月04日,"2日夜间,津城上空电闪雷鸣,部分地区还出现了短时对流和冰雹天气,对于气温有了小小打压。未来几天,津城晴雨相间,不会出现35℃以上的高温天气。今天,可能出现全...",http://www.tj.xinhuanet.com/news/2019-06/04/c_1124581227.htm?from=singlemessage
港城天气开启升温模式 明天最高气温将达36℃,中国江苏网,2019年06月04日,"进入6月以来,港城天气似乎开启了升温模式,这两天的太阳就像一个大火炉,炙烤着大地。不过,这些还只是开始,往后的日子,寻找凉快天是真的不容易了。根据市气象台最新...",http://jsnews.jschina.com.cn/lyg/a/201906/t20190604_2322249.shtml
高温 雷雨 大风 本周天气复杂多变,河南日报,2019年06月04日,"记者祁 博 如果用一个词来形容本周我市的天气将呈现出的性格,那么“刚猛”或许比较恰当。周初,我市气温会热得比较“刚猛”,或将...-河南日报网由河南日报...",https://www.henandaily.cn/content/2019/0604/168722.html
未来三天宁德市天气转好 8日迎来新一轮降雨,东南网,2019年06月04日,"据市气象台预测,6月4日全市天气多云,局部有阵雨,沿海东北风转偏南风3-4级。5日,全市天气多云到阴,有分散性阵雨,沿海偏南风5-6级。6日,全市天气多云到阴,...",http://fuan.fjsen.com/2019-06/04/content_22360705.htm
小麦收割丰收季 天气多变应注意,商广网,2019年06月04日,"商丘新闻网讯(记者 之相 建铭)大家都知道,天气变化对小麦收割有着十分重要的影响,眼下正值小麦收割季,农民朋友们一定要时刻关注天气变化,确保小麦颗粒归仓。 本...",http://sqtv.net/news/bencandy.php?fid=57&id=147838
天气的“火花”挺猛烈,银川晚报,2019年06月04日,"不信咱来看看节日期间的天气。  预计高考及端午节假日期间,我区大部时段天气以晴到多云为主,气温较高,4日下午到5日上午和9日前后,中南部地区有降雨。其中4日...",http://szb.ycen.com.cn/epaper/ycwb/html/2019-06/04/content_69403.htm
6月4日强对流天气预报:华北黄淮西南地区东部华南等地将有强对流,东方网,2019年06月04日,"-40毫米,局地可达50毫米以上;此外,内蒙古东部和南部、吉林东部、辽宁南部、河北北部、甘肃南部、山东西部和东部、四川盆地中东部等地的局地将有雷暴大风或冰雹天气...",http://tianqi.eastday.com/news/57658.html
本周天气:气温明显回升 高考期间略感闷热,台州在线,2019年06月04日,"本周,我们将迎来端午小长假,还有一年一度的高考,那么在这样重要的日子里,天气情况怎样呢,一起来了解一下。  上周末的雨水天气,给节日里的孩子们送去了清凉。到...",http://www.576tv.com/Program/355843.html
30℃+天气即将到达战场!金山高考天气是……,上海热线,2019年06月04日,"注定也将有不平凡的天气 今天你已经感觉很热了 别急,明天、后天会更热! 气温将迎来“3”字头! 这一周对广大学子来说 是至关重要的 他们将迎来人生的重要时刻...",https://hot.online.sh.cn/content/2019-06/04/content_9301810.htm
最新出炉 端午节加高考天气预报来了,新浪深圳站,2019年06月04日,"最新出炉 端午节加高考天气预报来了,高考期间天气多变,易突发局地短时强雷雨,具有“突发性强、持续时间短、局地差异大、易出现在午后”的特点。",http://shenzhen.sina.com.cn/news/s/2019-06-04/detail-ihvhiews6649145.shtml
高考芒种赛龙舟 本周天气看点多,浙江在线,2019年06月04日,"本周,赶上高考和端午节,芒种节气也来凑热闹。这一周,学生忙着考试,农民忙着夏收夏种,龙舟队忙着比赛。 昨日,阳光拉开了新一周的序幕。今早,好天气还是继续...",https://zj.zjol.com.cn/news.html?id=1213625
本周天气晴好 利于三夏收播,新华网河南站,2019年06月04日,"本周天气晴好 利于三夏收播 河南,郑州,新华网,新华网河南频道,专家提醒,本周三傍晚至周四白天,我市有阵雨、雷阵雨,有助于缓解旱情,利于玉米播种。",http://www.ha.xinhuanet.com/news/2019-06/04/c_1124579211.htm
北京最新天气预报:今日再迎雷阵雨 最高气温27℃,北晚新视觉,2019年06月04日,"今天北京将再次迎来雷阵雨天气。市气象台今天早晨6时发布天气预报:今天白天阴天间多云,有雷阵雨,北转东风二三间四级,最高气温27℃;夜间阴转多云,北部地区有雷阵雨...",https://www.takefoto.cn/viewnews-1805954.html
一周天气,天津日报,2019年06月04日,"根据最新气象资料分析,本周天气以多云为主,多局地对流降水天气,大部分时间气温较高,周最高气温32℃。具体预报如下: 一周天气预报: ●6月4日 多云,东南风转...",http://epaper.tianjinwe.com/tjrb/html/2019-06/04/content_189242_1116748.htm
石家庄市区天气预报,燕赵晚报,2019年06月04日,"石家庄市区天气预报 今天白天:多云,北部多云间阴有雷阵雨或零星阵雨 东北风3―4级 最高气温:31℃ 今天夜间:多云 偏北风2―3级 最低气温:22℃ 明天白天:多云...",http://yzwb.sjzdaily.com.cn/html/2019-06/04/content_1947797.htm
天气稳定白天闷热 留意午后雷阵雨,中时电子报,2019年06月04日,"中午过后在热力作用影响下,各地仍易有雷阵雨发生的机率,山区较易出现明显的雨势,下半天后锋面远离,天气将逐渐趋于稳定;气温方面,各地高温普遍在32至34度,感受闷热...",https://www.chinatimes.com/cn/realtimenews/20190604000919-260405?chdtv
高考会考期间:那大城区以晴热高温天气为主,儋州市政..,2019年06月04日,"据《今日儋州》消息 又到一年高考季,6月4日,记者从市气象局了解到,高考和会考期间(6月6日―10日),那大城区晴间多云,白天天气炎热,最高气温将达35―37℃,...",http://www.danzhou.gov.cn/danzhou/ywdt/jrdz/201906/t20190605_2586907.html
6月7日至9日 甘孜州大部考点以多云间阴天气为主,四川在线,2019年06月04日,"四川在线消息(记者 徐登林)6月4日下午,甘孜州气象台发布今年高考专题天气预报,7至9日,该州大部考点以多云间阴天气为主。 据最新气象资料分析:预计7日甘孜州...",https://sichuan.scol.com.cn/ggxw/201906/56992926.html
泉州高考天气预报一览 今起泉州降水有所减弱,闽南网,2019年06月04日,"新的一周开始,强降水仍在持续,昨天午后在西南急流控制下,泉州出现明显的强对流天气,部分乡镇有大雨,局部暴雨,局地伴有6―8级雷雨大风。近期降水持续时间长,强度...",http://www.mnw.cn/quanzhou/news/2166276.html
"天气升温,桃树上结出奇形怪状果",新浪新闻,2019年06月03日,"原标题:天气升温,桃树上结出奇形怪状果 扬子晚报网6月3日讯(记者 梅建明 通讯员 武家敏)自然界的造化神奇得让人不可思议,今天上午,在南京小桃园里,有棵桃树...",http://news.sina.com.cn/o/2019-06-03/doc-ihvhiqay3367963.shtml
《王者荣耀》KPL春季赛决赛因天气原因延期,Techweb,2019年06月03日,"因现场大风导致舞台存在安全隐患,今晚KPL王者荣耀职业联赛官方微博@KPL王者荣耀职业联赛称将延期举行比赛,并表示有额外补偿。 《王者荣耀》KPL春季赛总决赛今天下午在...",http://www.techweb.com.cn/ucweb/news/id/2738529
《王者荣耀》总决赛因天气原因延期 全服玩家获碎片等补偿,凤凰科技,2019年06月03日,"6月3日消息,昨日晚间,KPL王者荣耀职业联赛官方微博披露消息称,因西安地区出现大风天气,KPL春季",http://tech.ifeng.com/c/7nCOWmnHphX
高考期间无高温天气 明天大面积降雨为安徽送清凉,安徽网,2019年06月04日,"气象部门发布预告,明天我省将迎来大范围降水,目前在我省肆虐的高温天气将会被遏制。综合目前的气象资料看,高考期间,我省以多云天气为主,无高温天气。",http://www.ahwang.cn/zbah/20190604/1881484.shtml
受雷雨天气影响 首都机场通行能力将下降25%,东方网,2019年06月04日,"原标题:受雷雨天气影响 首都机场通行能力将下降25% 东方网6月4日消息:从下午16点起,北京首都机场再次迎来雷雨天气,预计将持续到20点。受其影响,首都机场通行能力...",http://news.eastday.com/c/20190604/u1a14883073.html
外有天气助力内有政策托底 玉米短线或企稳,东方财富网,2019年06月04日,"对于后市,范红军指出,后期玉米市场有两个方向看多,其一是天气和虫害炒作,通过远月带动近月上涨;其二是下游需求逐步恢复,或进入下一波补库阶段,通过现货推动期价上...","http://finance.eastmoney.com/news/1355,201906041142125484.html"
我市今起滚动发布高考气象信息天气闷热 考生注意防暑降温,港澳在线,2019年06月04日,"记者在分会场了解到,预计高考期间,我市无持续性暴雨或台风,天气闷热,考生须做好防暑降温准备。今天起,我市将滚动发布高考相关气象信息。 今天起,我市气象部门将...",http://www.gangaonet.com/zhusanjiao/2019/0604/106635.html
高考期间天气炎热局地有短时雷雨,深圳晚报,2019年06月04日,"深圳晚报讯 (记者 林咪玲 实习生 吕燕珊) 近日深圳多降雨,高考即将到来,考试期间天气状况广受关注。据市气象台消息,预计今日起,深圳暂别频繁强降雨过程,今日多云...",http://wb.sznews.com/MB/content/201906/04/content_665862.html
上海本周天气晴好开场 周四开始一波降水光顾,新浪上海站,2019年06月04日,"上海本周天气晴好开场 周四开始一波降水光顾,本周以晴好天气开场,可再过几天就要迎来阵雨天气咯!今天多云到晴。今天最高温度32度,最低温度20度,明天多云,但周四...",http://sh.sina.com.cn/news/m/2019-06-04/detail-ihvhiews6643700.shtml
高考期间 天气炎热有雷雨出门别忘带伞,晶报,2019年06月04日,"记者从市气象局了解到,6月5-6日有阵雨或雷阵雨,最高气温32℃;6月7-8日多云到晴天,天气炎热,局地有短时强雷雨,最高气温32-33℃;9日有雷阵雨,部分时间...",http://jb.sznews.com/PC/content/201906/04/content_665299.html
"端午小长假全国无大范围高温天气,高考天气如何有什么影响?",宁德晚报,2019年06月04日,"端午小长假全国无大范围高温天气,高考天气如何有什么影响?今年高考适逢端午节,那么高考期间天气如何?高考期间降雨与高温很有可能在我国南...",http://epaper.fjndwb.com/content/2019-06/04/15689.html
"高考遇上端午,你们最关心的小长假天气来啦!",澎湃新闻,2019年06月03日,"高考遇上端午 不论赶考,还是出行, 天气情况有必要提前知晓~ 6月3日 宁夏气象服务中心发布的 高考及端午节假期天气预报显示 高考期间没有降水天气,气温较高 6",http://www.thepaper.cn/newsDetail_forward_3601002
"紧急通知!这些地方还有暴雨!别慌,折磨人的天气就快结束了",澎湃新闻,2019年06月03日,"新朋友戳 蓝字关注我们哦! 6月2日,超凶暴雨突袭长春 长春一天集齐雷电、冰雹、暴雨 天气情况可以说非常激烈了 受华北热低压倒槽影响,昨晚一支水汽急流从渤海北上",http://www.thepaper.cn/newsDetail_forward_3596823
内江考生们注意:高考期天气预报来了――,澎湃新闻,2019年06月03日,"自打入夏以来呀 内江的天气就是 热几天,降一阵 热几天,降一阵 …… 上周,短短的几天时间里 仿佛轮回了一个四季 而就在本周 咱们将迎来一年一度的端午...",http://www.thepaper.cn/newsDetail_forward_3595760
我叫天气预报!信我就点我,澎湃新闻,2019年06月03日,我叫天气预报!信我就点我2019-06-03 15:58 来源:澎湃新闻 媒体 字号 新闻大连  +关注6月4日白天到夜间多云东风5-6级转东南风4-5级18~24℃6月5日白天到...,http://www.thepaper.cn/newsDetail_forward_3598858
穷游网与中国天气网达成战略合作 助力智慧旅游,中国经营网,2019年06月03日,"近日,全球旅行生活分享平台穷游网联合中国天气网正式达成合作协议,基于穷游网丰富的线上旅游景点信息与中国天气网的景区天气大数据优势,将在中国天气网WAP端,全新推出...",http://www.cb.com.cn/index/show/gd/cv/cv135676181498
"今天最高温31℃!杭州这一周天气,太不淡定了",澎湃新闻,2019年06月03日,"这几天的天气怎么样?根据目前的天气预报,6月7日是多云转晴的天气,6月8日下午到夜里会有阵雨,6月9日是小雨转晴的天气。全省来看,6月5日起,我省受暖区天气...",http://www.thepaper.cn/newsDetail_forward_3595699
厦门今日仍有雨需带伞再出门 明起天气将逐渐转好,网易,2019年06月03日,"厦门网讯(海西晨报记者曾昊然通讯员其翔)昨天,厦门的天气又阴晴不定。上午,天气还不错,甚至还出现了几缕阳光,但到了下午,天空变得阴沉,厦门气象台还发布了暴雨...",http://3g.163.com/news/article/EGNVO7UI04418D23.html
昨日河南包揽全国高温榜前十名 6-8日高温天气将缓解,新浪河南,2019年06月03日,"5日下午到夜里,全省多云到阴天,东南部有小到中阵雨、雷阵雨,雨量分布不均,局地伴有短时强降水、雷暴大风等强对流天气;其它地区有分散性阵雨、雷阵雨。...",http://henan.sina.com.cn/news/z/2019-06-03/detail-ihvhiqay3247161.shtml?from=henan_ydph
首都机场迎雷雨天气 启动航班延误黄色响应机制,和讯,2019年06月04日,"民航资源网2019年6月4日消息:受高空槽影响,首都机场于6月4日迎来本月第四次雷雨天气过程,对首都机场早出港航班造成较大影响。首都机场于8点30分启动首都机场大...",http://news.hexun.com/2019-06-04/197413489.html
高考期间合肥天气总体“给力”:以多云天为主最高气温32度左右,万家热线,2019年06月04日,"一年一度的高考即将拉开大幕,高考期间的天气状况广大考生和家长较为关注。记者昨天从市气象部门获悉,从目前预报情况来看,6月7、8日,我市最高气温在32度左右,总...",http://365jia.cn/news/2019-06-04/28BC03AB676E7518.html
